Judul Artikel,Link,Waktu_Scraping,Berita_Hoax
"Tagih Janji Menangkan Ganjar, PKS: PDIP Selalu Anggap Jokowi Petugas Partai",/read/N6GC8Qdw-tagih-janji-menangkan-ganjar-pks-pdip-selalu-anggap-jokowi-petugas-partai,2023-10-11,False
Peluncuran Distro Ganjar Dorong Penggunaan Produk Dalam Negeri,/play/KvJCBGwX-peluncuran-distro-ganjar-dorong-penggunaan-produk-dalam-negeri,2023-10-11,False
Sandiaga Mengaku Belum Dapat Sinyal Bakal Dapat Tiket Cawapres,/read/kBVC2xmp-sandiaga-mengaku-belum-dapat-sinyal-bakal-dapat-tiket-cawapres,2023-10-11,False
Srikandi Ganjar Gelar Pelatihan Membuat Roti Buaya Bersama Milenial,/play/NnjC7yw5-srikandi-ganjar-gelar-pelatihan-membuat-roti-buaya-bersama-milenial,2023-10-11,False
PDIP: Tim 7 akan Latih Jurkam untuk Ganjar,/read/kELC1AMJ-pdip-tim-7-akan-latih-jurkam-untuk-ganjar,2023-10-11,False
Hasto Ingatkan Kader PDIP Harus Pakai Bahasa Santun,/read/KZmCvORm-hasto-ingatkan-kader-pdip-harus-pakai-bahasa-santun,2023-10-11,False
Ganjar Pamitan Jelang Akhir Tugas Gubernur,/read/b3JCyzWO-ganjar-pamitan-jelang-akhir-tugas-gubernur,2023-10-11,False
SPN Ubah Dukungan dari Ganjar ke Anies,/play/NP6CZ8pZ-spn-ubah-dukungan-dari-ganjar-ke-anies,2023-10-11,False
Gibran Diminta Kawal Ganjar dalam Pilpres 2024,/read/NxGC5MOP-gibran-diminta-kawal-ganjar-dalam-pilpres-2024,2023-10-11,False
Sandiaga Uno Ungkap Pertemuan dengan Jokowi Bahas Cawapres Ganjar,/play/kj2CAQdv-sandiaga-uno-ungkap-pertemuan-dengan-jokowi-bahas-cawapres-ganjar,2023-10-11,False
Ganjar Optimistis Santriwati Bisa Berperan Mewujudkan Indonesia Emas 2045,/play/b7WCRQld-ganjar-optimistis-santriwati-bisa-berperan-mewujudkan-indonesia-emas-2045,2023-10-11,False
Khofifah Tolak Tawaran Jadi Timses Ganjar,/read/k8oCLdGJ-khofifah-tolak-tawaran-jadi-timses-ganjar,2023-10-11,False
PDIP Dinilai Masih Mengincar Parpol Besar,/read/KRXCaXLA-pdip-dinilai-masih-mengincar-parpol-besar,2023-10-11,False
PDIP Bantah Sengaja Ganggu Partai Koalisi Sebelah,/read/kWDCO8MV-pdip-bantah-sengaja-ganggu-partai-koalisi-sebelah,2023-10-11,False
Warga Terdampak Tol Semarang-Demak Geruduk Kantor Ganjar,/read/bw6CYl3D-warga-terdampak-tol-semarang-demak-geruduk-kantor-ganjar,2023-10-11,False
"Tegas, PDIP Bakal Pecat Kader yang Tak Dukung Ganjar",/play/NrWCZ0Ap-tegas-pdip-bakal-pecat-kader-yang-tak-dukung-ganjar,2023-10-11,False
Gibran Belum Ingin Bocorkan Nama Capres Pilihan Jokowi,/read/kpLCrdmB-gibran-belum-ingin-bocorkan-nama-capres-pilihan-jokowi,2023-10-11,False
PDIP Dinilai Mulai Membuat Koalisi Lain Kacau,/read/KRXCaXM1-pdip-dinilai-mulai-membuat-koalisi-lain-kacau,2023-10-11,False
Ratusan Tukang Becak di Bogor Deklarasi Dukung Ganjar di Pilpres 2024,/play/kM6C05eA-ratusan-tukang-becak-di-bogor-deklarasi-dukung-ganjar-di-pilpres-2024,2023-10-11,False
Relawan Asal Jambi Temui Ganjar Pranowo di Jakarta,/play/NLMCOopV-relawan-asal-jambi-temui-ganjar-pranowo-di-jakarta,2023-10-11,False
Ganjar Ngopi Bareng dengan Relawan di Ancol,/play/N6GC8Md7-ganjar-ngopi-bareng-dengan-relawan-di-ancol,2023-10-11,False
Pena Mas Ganjar Ajak Warga Rawat Wilayah Pesisir Jawa Tengah,/play/KRXCaXvB-pena-mas-ganjar-ajak-warga-rawat-wilayah-pesisir-jawa-tengah,2023-10-11,False
Anies-Ganjar Bertemu dan Kompak Berikan Tanda 'Saranghae',/play/NgxC8yjz-anies-ganjar-bertemu-dan-kompak-berikan-tanda-saranghae,2023-10-11,False
Ganjar Mengaku Sering 'Diserang' Gara-gara Zonasi PPDB,/read/NnjC7E3Q-ganjar-mengaku-sering-diserang-gara-gara-zonasi-ppdb,2023-10-11,False
Ganjar Sebut Sekolah di Indonesia Buat Siswa Stres,/read/KYVCJAzG-ganjar-sebut-sekolah-di-indonesia-buat-siswa-stres,2023-10-11,False
Respons Ganjar Soal Jokowi Sudah Punya Jagoan Pilpres 2024,/read/bmRCmPQx-respons-ganjar-soal-jokowi-sudah-punya-jagoan-pilpres-2024,2023-10-11,False
"Bantah Jadi Jurkam Ganjar, Gibran: Belum Waktunya Kampanye",/read/NP6CZMV5-bantah-jadi-jurkam-ganjar-gibran-belum-waktunya-kampanye,2023-10-11,False
Survei Indikator: Ganjar-Erick Tertinggi di Simulasi 3 Pasangan Capres-Cawapres,/play/KYVCJA7n-survei-indikator-ganjar-erick-tertinggi-di-simulasi-3-pasangan-capres-cawapres,2023-10-11,False
Mengulik Makna Kemeja Hitam Putih Ganjar Pranowo Desain Jokowi,/play/NA0CXlrj-mengulik-makna-kemeja-hitam-putih-ganjar-pranowo-desain-jokowi,2023-10-11,False
Puan Rayu Muhaimin Masuk Kandidat Wapres Ganjar,/play/bmRCmPyR-puan-rayu-muhaimin-masuk-kandidat-wapres-ganjar,2023-10-11,False
Tim Teknis Golkar dan PDIP Belum Godok Soal Cawapres,/read/NP6CZMAP-tim-teknis-golkar-dan-pdip-belum-godok-soal-cawapres,2023-10-11,False
Puan Sebut Pertemuannya dengan Cak Imin dan Airlangga Tak Sebatas Cari Cawapres Ganjar,/read/k8oCLj49-puan-sebut-pertemuannya-dengan-cak-imin-dan-airlangga-tak-sebatas-cari-cawapres-ganjar,2023-10-11,False
Tim Teknis PDIP dan Golkar Bahas Arah Dukungan KIB kepada Ganjar,/read/KYVCJA6W-tim-teknis-pdip-dan-golkar-bahas-arah-dukungan-kib-kepada-ganjar,2023-10-11,False
Pandawa Ganjar Gelar Diskusi Kearifan Lokal Muda Dayak untuk IKN Nusantara,/play/N4EC2PxD-pandawa-ganjar-gelar-diskusi-kearifan-lokal-muda-dayak-untuk-ikn-nusantara,2023-10-11,False
Pertemuan Puan dan Airlangga Bukan Cawe-Cawe untuk Ganjar Pranowo,/play/N9nC6V4y-pertemuan-puan-dan-airlangga-bukan-cawe-cawe-untuk-ganjar-pranowo,2023-10-11,False
Puan Bantah Ngawur Sebut Cak Imin Masuk Radar Cawapres Ganjar,/read/bw6CYly4-puan-bantah-ngawur-sebut-cak-imin-masuk-radar-cawapres-ganjar,2023-10-11,False
PDIP Umumkan Cawapres Ganjar 4 November,/read/K5nC4oJM-pdip-umumkan-cawapres-ganjar-4-november,2023-10-11,False
Sandiaga Serahkan Keputusan Cawapres Ganjar kepada Megawati,/read/KvJCBX5G-sandiaga-serahkan-keputusan-cawapres-ganjar-kepada-megawati,2023-10-11,False
Cak Imin Bertemu Puan Bahas Cawapres Ganjar,/read/Ky6CBVRX-cak-imin-bertemu-puan-bahas-cawapres-ganjar,2023-10-11,False
"Usai Cak Imin, Puan Akan Bertemu Airlangga Hari Ini",/read/kM6C05y5-usai-cak-imin-puan-akan-bertemu-airlangga-hari-ini,2023-10-11,False
Ganjar Disebut Rugi Tak Ikut 'Berebut Hati' Kades di Rakernas Apdesi,/play/kqYCE8Og-ganjar-disebut-rugi-tak-ikut-berebut-hati-kades-di-rakernas-apdesi,2023-10-11,False
Ganjar Pranowo Serap Aspirasi Warga Banjarnegara,/play/kqYCE8Vn-ganjar-pranowo-serap-aspirasi-warga-banjarnegara,2023-10-11,False
Puan Maharani Beberkan Lima Kriteria Pendamping Ganjar,/play/ba4C0ROA-puan-maharani-beberkan-lima-kriteria-pendamping-ganjar,2023-10-11,False
Sandiaga Diyakini Mampu Dongkrak Keterpilihan Ganjar,/read/NP6CZox4-sandiaga-diyakini-mampu-dongkrak-keterpilihan-ganjar,2023-10-11,False
Alasan Anang Hermansyah Pindah dari PAN ke PDIP,/read/b3JCy6m2-alasan-anang-hermansyah-pindah-dari-pan-ke-pdip,2023-10-11,False
Airlangga Disebut Harus Segera Bersikap,/read/bD2CZ6v6-airlangga-disebut-harus-segera-bersikap,2023-10-11,False
"Sambut Indonesia Emas, Ganjar Dongkrak Semangat Guru",/play/bD2CZ6EY-sambut-indonesia-emas-ganjar-dongkrak-semangat-guru,2023-10-11,False
Panglima Instruksikan Jajaran TNI Netral di Pemilu 2024,/read/NxGC5LwX-panglima-instruksikan-jajaran-tni-netral-di-pemilu-2024,2023-10-11,False
PKB Mengaku Meleleh Digoda PDIP,/read/KRXCaYYV-pkb-mengaku-meleleh-digoda-pdip,2023-10-11,False
Demokrat Istikamah Dukung Anies Meski AHY Masuk Kandidat Cawapres Ganjar,/read/NnjC7P63-demokrat-istikamah-dukung-anies-meski-ahy-masuk-kandidat-cawapres-ganjar,2023-10-11,False
"Jangan Hanya Jawa Tengah, Jokowi Diminta Bantu Warga di Seluruh Pelosok Indonesia",/read/KXyC9r1G-jangan-hanya-jawa-tengah-jokowi-diminta-bantu-warga-di-seluruh-pelosok-indonesia,2023-10-11,False
Puan: Ada 5 Kandidat Bacawapres Ganjar Pranowo,/play/N6GC8Z5L-puan-ada-5-kandidat-bacawapres-ganjar-pranowo,2023-10-11,False
Santrine Abah Ganjar Gelar Istighosah untuk Pemilu Damai,/play/KRXCaYy0-santrine-abah-ganjar-gelar-istighosah-untuk-pemilu-damai,2023-10-11,False
Gibran Mengenakan Baju Garis Hitam Putih saat Dampingi Ganjar di Solo,/play/NxGC5LVj-gibran-mengenakan-baju-garis-hitam-putih-saat-dampingi-ganjar-di-solo,2023-10-11,False
PPP Terus Lakukan Pendekatan ke PDIP,/read/NnjC7PV4-ppp-terus-lakukan-pendekatan-ke-pdip,2023-10-11,False
Presiden Jokowi Tinjau Kondisi Jalan Solo-Purwodadi,/play/ba4C07lP-presiden-jokowi-tinjau-kondisi-jalan-solo-purwodadi,2023-10-11,False
"Bocorkan 5 Nama Cawapres Ganjar, Puan: Ada Mas AHY dan Cak Imin",/read/bJECnXwQ-bocorkan-5-nama-cawapres-ganjar-puan-ada-mas-ahy-dan-cak-imin,2023-10-11,False
Gibran Dinilai 'Setengah Hati' Jadi Juru Kampanye Ganjar,/play/kqYCEwRj-gibran-dinilai-setengah-hati-jadi-juru-kampanye-ganjar,2023-10-11,False
Pena Mas Ganjar Beri Penyuluhan dan Salurkan Bantuan ke Petani di Boyolali,/play/NLMCOEBn-pena-mas-ganjar-beri-penyuluhan-dan-salurkan-bantuan-ke-petani-di-boyolali,2023-10-11,False
Jokowi Ungkap Jalan di Jateng Ini Tak Pernah Beres Sejak Dirinya Kecil,/read/bzGCg7al-jokowi-ungkap-jalan-di-jateng-ini-tak-pernah-beres-sejak-dirinya-kecil,2023-10-11,False
PDIP Masih Yakin Jokowi Dukung Ganjar di Pilpres 2024,/read/bzGCg7Ml-pdip-masih-yakin-jokowi-dukung-ganjar-di-pilpres-2024,2023-10-11,False
Ganjar Milenial Jateng Gelar Pelatihan Jurnalistik di Semarang,/play/KvJCBrE4-ganjar-milenial-jateng-gelar-pelatihan-jurnalistik-di-semarang,2023-10-11,False
Hasto: Gibran Juru Kampanye Ganjar,/play/kM6C0PYG-hasto-gibran-juru-kampanye-ganjar,2023-10-11,False
"Gibran: Dekat dengan Semua Bacapres, Paling Dekat dengan Ganjar",/play/kqYCEwgy-gibran-dekat-dengan-semua-bacapres-paling-dekat-dengan-ganjar,2023-10-11,False
Gibran Resmi Jadi Juru Kampanye Ganjar Pranowo,/play/bVDCOdRy-gibran-resmi-jadi-juru-kampanye-ganjar-pranowo,2023-10-11,False
Ganjar Pranowo Hadiri Central Java Coop's Fest 2023 di Semarang,/play/NrWCZn4M-ganjar-pranowo-hadiri-central-java-coop-s-fest-2023-di-semarang,2023-10-11,False
Ganjar Sebut Bima Arya Dukung Dirinya sebagai Bacapres Sejak Awal,/play/NQAC29QB-ganjar-sebut-bima-arya-dukung-dirinya-sebagai-bacapres-sejak-awal,2023-10-11,False
Ganjar: Gibran Bersedia Jadi Jurkam Saya,/play/KvJCBroW-ganjar-gibran-bersedia-jadi-jurkam-saya,2023-10-11,False
Dominasi PDIP Dinilai Hambat Parpol Parlemen Merapat ke Koalisi Ganjar,/read/KRXCaYz7-dominasi-pdip-dinilai-hambat-parpol-parlemen-merapat-ke-koalisi-ganjar,2023-10-11,False
Destinasi Super Prioritas Borobudur Ditargetkan Raup USD 2 Miliar,/read/NLMCOE2r-destinasi-super-prioritas-borobudur-ditargetkan-raup-usd-2-miliar,2023-10-11,False
Jawa Barat Jadi Provinsi Tujuan Investasi Terbanyak,/read/k8oCLAL1-jawa-barat-jadi-provinsi-tujuan-investasi-terbanyak,2023-10-11,False
Ganjar Pranowo Silaturahmi dengan Masyayikh di Rembang Jawa Tengah,/play/NG9C5Pr5-ganjar-pranowo-silaturahmi-dengan-masyayikh-di-rembang-jawa-tengah,2023-10-11,False
Mendagri Ingatkan Kepala Daerah Jangan Sibuk Berpolitik,/read/NQAC29O9-mendagri-ingatkan-kepala-daerah-jangan-sibuk-berpolitik,2023-10-11,False
Jokowi-Surya Paloh Dinilai Tunjukkan Kedewasaan Berpolitik,/read/N9nC6WGG-jokowi-surya-paloh-dinilai-tunjukkan-kedewasaan-berpolitik,2023-10-11,False
Safari Politik Ganjar Dikritik,/play/NrWCZndZ-safari-politik-ganjar-dikritik,2023-10-11,False
Andika Perkasa Digoda PDIP Jadi Bacawapres Ganjar,/play/KRXCaY2Z-andika-perkasa-digoda-pdip-jadi-bacawapres-ganjar,2023-10-11,False
Gibran Jadi Jurkam Ganjar Pranowo,/play/NG9C5PY8-gibran-jadi-jurkam-ganjar-pranowo,2023-10-11,False
"Tabrakan KA Brantas vs Truk Dramatis, Saksi: Seperti Film Action",/read/k8oCLByP-tabrakan-ka-brantas-vs-truk-dramatis-saksi-seperti-film-action,2023-10-11,False
Ganjar Tinjau Evakuasi Kecelakaan KA Brantas,/play/bzGCgl8a-ganjar-tinjau-evakuasi-kecelakaan-ka-brantas,2023-10-11,False
Andika Perkasa Jadi Pemateri Tim Pemenangan Ganjar Pranowo,/play/NLMCOMQY-andika-perkasa-jadi-pemateri-tim-pemenangan-ganjar-pranowo,2023-10-11,False
Pesta Rakyat Ganjar Pranowo Sukses Hibur Warga Gresik,/play/b7WCRJWL-pesta-rakyat-ganjar-pranowo-sukses-hibur-warga-gresik,2023-10-11,False
Presiden Jokowi Bentuk Tim 7 Pemenangan Ganjar Pranowo,/play/b3JCyBQY-presiden-jokowi-bentuk-tim-7-pemenangan-ganjar-pranowo,2023-10-11,False
Ganjar Pastikan Pembangunan PSN di Jateng Jalan Terus,/play/NG9C5o1y-ganjar-pastikan-pembangunan-psn-di-jateng-jalan-terus,2023-10-11,False
Erosi Koperasi,/read/bw6CY3l0-erosi-koperasi,2023-10-11,False
Ganjar Minta Relawan Tak Sembarangan Pasang Baliho,/play/NleC0xvd-ganjar-minta-relawan-tak-sembarangan-pasang-baliho,2023-10-11,False
Panglima TNI: Pencopotan Baliho Ganjar di Lingkungan TNI Bukan Secara Paksa,/play/NOlCYddd-panglima-tni-pencopotan-baliho-ganjar-di-lingkungan-tni-bukan-secara-paksa,2023-10-11,False
Latar Belakang TNI-Polri Bakal Dipakai untuk Mengeruk Suara Purnawirawan,/read/b3JCyBBg-latar-belakang-tni-polri-bakal-dipakai-untuk-mengeruk-suara-purnawirawan,2023-10-11,False
"Belum Bersikap, Golkar Masih Jajaki Komunikasi dengan Banyak Partai",/read/b2lCrRRZ-belum-bersikap-golkar-masih-jajaki-komunikasi-dengan-banyak-partai,2023-10-11,False
PDIP Sebut Jokowi Bentuk Tim 7 Pemenangan Ganjar Pranowo,/read/NP6CZWqM-pdip-sebut-jokowi-bentuk-tim-7-pemenangan-ganjar-pranowo,2023-10-11,False
"Hadir ke Apel Siaga Perubahan, Golkar Lebih Klop dengan NasDem?",/read/NP6CZWvM-hadir-ke-apel-siaga-perubahan-golkar-lebih-klop-dengan-nasdem,2023-10-11,False
TNI Sebut Pencopotan Banner Foto Capres Ganjar Pranowo Sesuai Prosedur,/read/b3JCyBDg-tni-sebut-pencopotan-banner-foto-capres-ganjar-pranowo-sesuai-prosedur,2023-10-11,False
Anies Dinilai Tepat Tak Umumkan Cawapres di Apel Siaga Perubahan,/read/KdZCVxX9-anies-dinilai-tepat-tak-umumkan-cawapres-di-apel-siaga-perubahan,2023-10-11,False
Pikiran Anies Baswedan Kian Tajam Usai Pulang Haji,/read/NxGC5xD4-pikiran-anies-baswedan-kian-tajam-usai-pulang-haji,2023-10-11,False
"Jokowi Sebut Koalisi Pilpres Belum Jelas, PKS: Seperti Pengamat",/read/NgxC8A6L-jokowi-sebut-koalisi-pilpres-belum-jelas-pks-seperti-pengamat,2023-10-11,False
Survei: Kekuatan Narasi Perubahan Menjanjikan,/read/KvJCBd9l-survei-kekuatan-narasi-perubahan-menjanjikan,2023-10-11,False
"Ujian 'Satu Kata' untuk Ganjar, Anies dan Prabowo di Rakernas Apeksi 2023",/play/bD2CZmJG-ujian-satu-kata-untuk-ganjar-anies-dan-prabowo-di-rakernas-apeksi-2023,2023-10-11,False
"Momen Anies, Ganjar dan Prabowo Tampil Satu Panggung",/play/KZmCvmoW-momen-anies-ganjar-dan-prabowo-tampil-satu-panggung,2023-10-11,False
Ganjar Pranowo: IKN Adalah Masa Depan Indonesia,/play/bVDCOB6a-ganjar-pranowo-ikn-adalah-masa-depan-indonesia,2023-10-11,False
Puja-puji Menteri Teten untuk Ganjar Berbuah Kritik Pedas,/play/NxGC5xXR-puja-puji-menteri-teten-untuk-ganjar-berbuah-kritik-pedas,2023-10-11,False
Prabowo Sebut Ganjar Gubernur dan Anies Profesor,/play/Ky6CBr1Y-prabowo-sebut-ganjar-gubernur-dan-anies-profesor,2023-10-11,False
Isu Munaslub Disebut Upaya Ganggu Soliditas Golkar,/read/b3JCyBrj-isu-munaslub-disebut-upaya-ganggu-soliditas-golkar,2023-10-11,False
"Anies Sebut Prabowo Patriot, Ganjar Sahabat Lama",/read/NxGC5x5J-anies-sebut-prabowo-patriot-ganjar-sahabat-lama,2023-10-11,False
"PDIP Rayu Gabung Koalisi Dukung Ganjar, PKB Lapor ke Gerindra",/read/NOlCYdGE-pdip-rayu-gabung-koalisi-dukung-ganjar-pkb-lapor-ke-gerindra,2023-10-11,False
PKB Berpeluang Tawarkan Cak Imin saat Sowan ke Megawati,/read/NxGC5xOA-pkb-berpeluang-tawarkan-cak-imin-saat-sowan-ke-megawati,2023-10-11,False
"Anies, Ganjar, dan Prabowo Satu Panggung di Rakernas Apeksi",/play/bmRCmMy7-anies-ganjar-dan-prabowo-satu-panggung-di-rakernas-apeksi,2023-10-11,False
Ganjar Serap Langsung Aspirasi dan Keluhan Warga Sukoharjo,/play/KXyC9ZwJ-ganjar-serap-langsung-aspirasi-dan-keluhan-warga-sukoharjo,2023-10-11,False
"Partai NasDem Sambut Baik Rencana Anies, Ganjar & Prabowo Bertemu di Apeksi",/play/KRXCax0G-partai-nasdem-sambut-baik-rencana-anies-ganjar-prabowo-bertemu-di-apeksi,2023-10-11,False
Nurdin Halid: Dekopin Bukan Organisasi Perjuangan Politik,/read/NOlCYdDx-nurdin-halid-dekopin-bukan-organisasi-perjuangan-politik,2023-10-11,False
Senior Golkar Diklaim Tahu Arah Rekomendasi Dewan Pakar,/read/b2lCrRv8-senior-golkar-diklaim-tahu-arah-rekomendasi-dewan-pakar,2023-10-11,False
"Teten Sebut Ganjar Harapan Kemajuan Ekonomi, Pengamat: Ada Makna Politis",/read/NA0CXQ4P-teten-sebut-ganjar-harapan-kemajuan-ekonomi-pengamat-ada-makna-politis,2023-10-11,False
PKB Dirayu PDIP Buat Gabung Koalisi Dukung Ganjar,/read/bD2CZmdL-pkb-dirayu-pdip-buat-gabung-koalisi-dukung-ganjar,2023-10-11,False
"Anies Baswedan hingga Prabowo Bakal Satu Forum, NasDem: Ajang Adu Gagasan",/read/KZmCvme3-anies-baswedan-hingga-prabowo-bakal-satu-forum-nasdem-ajang-adu-gagasan,2023-10-11,False
"Tersalip Prabowo, PDIP Siap Dongkrak Elektabilitas Ganjar Pranowo",/play/NG9C5oEw-tersalip-prabowo-pdip-siap-dongkrak-elektabilitas-ganjar-pranowo,2023-10-11,False
"Genjot Elektabilitas Anies, Koalisi Perubahan Segera Konsolidasi Bersama",/read/N0BCrqx1-genjot-elektabilitas-anies-koalisi-perubahan-segera-konsolidasi-bersama,2023-10-11,False
"Sejumlah Kader Golkar Bikin Surat Terbuka, Dorong Pergantian Airlangga",/read/k8oCLBww-sejumlah-kader-golkar-bikin-surat-terbuka-dorong-pergantian-airlangga,2023-10-11,False
"Agustus 2023, Airlangga Bergerak sebagai Capres",/read/N4EC2Oye-agustus-2023-airlangga-bergerak-sebagai-capres,2023-10-11,False
Golkar Tepis Ada Kelompok Ingin Ganti Airlangga,/read/NP6CZWYl-golkar-tepis-ada-kelompok-ingin-ganti-airlangga,2023-10-11,False
Anies Sebut Tak Bahas Pilpres Saat Bertemu Ganjar di Makkah,/read/KvJCBdMo-anies-sebut-tak-bahas-pilpres-saat-bertemu-ganjar-di-makkah,2023-10-11,False
Ganjar Marah saat Tahu Siswa SMKN Dipungut Biaya dengan Dalih Infak,/play/b3JCyBYV-ganjar-marah-saat-tahu-siswa-smkn-dipungut-biaya-dengan-dalih-infak,2023-10-11,False
"Elektabilitas Ganjar Disalip Prabowo, Puan Tak Kuatir",/play/N9nC6X9Q-elektabilitas-ganjar-disalip-prabowo-puan-tak-kuatir,2023-10-11,False
Gerindra Sebut Masih Ada Peluang Duet Prabowo dengan Ganjar di Pilpres 2024,/play/NxGC5x26-gerindra-sebut-masih-ada-peluang-duet-prabowo-dengan-ganjar-di-pilpres-2024,2023-10-11,False
Survei: Erick Thohir  dan Ridwan Kamil Bersaing Ketat,/read/kM6C0oJ7-survei-erick-thohir-dan-ridwan-kamil-bersaing-ketat,2023-10-11,False
Survei: Prabowo Lebih Menjanjikan Berpasangan dengan Erick Thohir Ketimbang Cak Imin,/read/NG9C5MDx-survei-prabowo-lebih-menjanjikan-berpasangan-dengan-erick-thohir-ketimbang-cak-imin,2023-10-11,False
Ganjar Pilih Perbaiki RS Ketimbang Bahas Isu Setengah Hati Jokowi,/read/KRXCa7Wx-ganjar-pilih-perbaiki-rs-ketimbang-bahas-isu-setengah-hati-jokowi,2023-10-11,False
"Diberi Waktu Hingga Agustus, Golkar Siap Carikan Cawapres untuk Airlangga",/read/N9nC6Jm7-diberi-waktu-hingga-agustus-golkar-siap-carikan-cawapres-untuk-airlangga,2023-10-11,False
Golkar Berpeluang Bikin Poros Sendiri di Luar KIB,/read/KYVCJo39-golkar-berpeluang-bikin-poros-sendiri-di-luar-kib,2023-10-11,False
"Naik Turun, Elektabilitas Prabowo dan Ganjar Ditelaah",/read/K5nC4Z3M-naik-turun-elektabilitas-prabowo-dan-ganjar-ditelaah,2023-10-11,False
Airlangga Diminta Bikin Poros Baru dan Cari Cawapres,/read/KdZCVz5m-airlangga-diminta-bikin-poros-baru-dan-cari-cawapres,2023-10-11,False
3 Poin Rekomendasi Dewan Pakar Golkar buat Airlangga,/read/NA0CXoLB-3-poin-rekomendasi-dewan-pakar-golkar-buat-airlangga,2023-10-11,False
"Bamsoet Senada dengan Airlangga, Tak Ada Munaslub Golkar",/read/kELC1O9Q-bamsoet-senada-dengan-airlangga-tak-ada-munaslub-golkar,2023-10-11,False
Sinyal Restu Jokowi untuk Prabowo,/read/kWDCOqXD-sinyal-restu-jokowi-untuk-prabowo,2023-10-11,False
Latar Belakang Pendukung Capres Berdasarkan Tingkat Kepercayaan Lembaga dan Media,/read/b3JCy0zR-latar-belakang-pendukung-capres-berdasarkan-tingkat-kepercayaan-lembaga-dan-media,2023-10-11,False
Latar Belakang Pendukung Capres Berdasarkan Medsos yang Digunakan,/read/NLMCOGoa-latar-belakang-pendukung-capres-berdasarkan-medsos-yang-digunakan,2023-10-11,False
Isu IKN Jadi Salah Satu Pertimbangan Publik Memilih Capres,/read/NxGC57Jw-isu-ikn-jadi-salah-satu-pertimbangan-publik-memilih-capres,2023-10-11,False
"Gambaran Elektabilitas Prabowo, Anies, dan Ganjar Berdasarkan Survei LSI Denny JA",/read/KXyC91J1-gambaran-elektabilitas-prabowo-anies-dan-ganjar-berdasarkan-survei-lsi-denny-ja,2023-10-11,False
"Survei: Cawapres Pilihan Publik Dampingi Anies, Prabowo, dan Ganjar",/read/bzGCgxqv-survei-cawapres-pilihan-publik-dampingi-anies-prabowo-dan-ganjar,2023-10-11,False
Effendi Simbolon Tetap Dukung Ganjar Pranowo pada Pilpres 2024,/play/K5nC4Zro-effendi-simbolon-tetap-dukung-ganjar-pranowo-pada-pilpres-2024,2023-10-11,False
Sekjen PDIP: Effendi Simbolon Tetap Perjuangkan Kemenangan Ganjar,/play/KRXCa7X8-sekjen-pdip-effendi-simbolon-tetap-perjuangkan-kemenangan-ganjar,2023-10-11,False
Survei: Ganjar Kalah Head to Head dengan Prabowo,/read/bJECnpXx-survei-ganjar-kalah-head-to-head-dengan-prabowo,2023-10-11,False
PDIP Siap Terima Kunjungan Prabowo,/read/b3JCy06R-pdip-siap-terima-kunjungan-prabowo,2023-10-11,False
"Dipanggil PDIP, Effendi Simbolon Tak Seharusnya Beri Sinyal Dukungan ke Prabowo",/read/b7WCRLJq-dipanggil-pdip-effendi-simbolon-tak-seharusnya-beri-sinyal-dukungan-ke-prabowo,2023-10-11,False
Airlangga Bantah Akan Ada Munaslub untuk Menggantikannya sebagai Bacapres Golkar,/read/b1oC8jZz-airlangga-bantah-akan-ada-munaslub-untuk-menggantikannya-sebagai-bacapres-golkar,2023-10-11,False
"Relawan Pendukung Anies, Prabowo dan Ganjar Serukan Pemilu Bermartabat",/play/bD2CZz6e-relawan-pendukung-anies-prabowo-dan-ganjar-serukan-pemilu-bermartabat,2023-10-11,False
Pernyataan Effendi Simbolon Soal Prabowo Akan Ditentukan Dewan Kehormatan PDIP,/read/N0BCrZZr-pernyataan-effendi-simbolon-soal-prabowo-akan-ditentukan-dewan-kehormatan-pdip,2023-10-11,False
Survei: Nama Ahmad Sahroni Muncul Sebagai Cawapres di Pemilu 2024,/read/kqYCEQQn-survei-nama-ahmad-sahroni-muncul-sebagai-cawapres-di-pemilu-2024,2023-10-11,False
Respons Pengurus Soal Rencana Dewan Pakar Evaluasi Munas Golkar 2019,/read/K5nC4ZEO-respons-pengurus-soal-rencana-dewan-pakar-evaluasi-munas-golkar-2019,2023-10-11,False
"Dewan Pakar Golkar Gelar Rapat, Keputusan Munas Soal Pencapresan Airlangga Dievaluasi",/read/K5nC4ZEJ-dewan-pakar-golkar-gelar-rapat-keputusan-munas-soal-pencapresan-airlangga-dievaluasi,2023-10-11,False
Ganjar Pranowo Kunjungi Pameran ArtJog 2023,/play/KRXCa7oa-ganjar-pranowo-kunjungi-pameran-artjog-2023,2023-10-11,False
PAN Tawarkan Erick Thohir dan Zulhas Sebagai Cawapres,/read/koGCV1OR-pan-tawarkan-erick-thohir-dan-zulhas-sebagai-cawapres,2023-10-11,False
Pengamat: Jokowi Dinilai Khawatir Ganjar Tak Mengakomodasi Kepentingannya,/read/kELC1Oav-pengamat-jokowi-dinilai-khawatir-ganjar-tak-mengakomodasi-kepentingannya,2023-10-11,False
Kepantasan Jokowi Undang Anies hingga Prabowo Dipertanyakan,/read/NOlCYQoR-kepantasan-jokowi-undang-anies-hingga-prabowo-dipertanyakan,2023-10-11,False
Sandiaga Uno Enggan Cawe-Cawe soal Cawapres Ganjar,/play/bmRCmG1A-sandiaga-uno-enggan-cawe-cawe-soal-cawapres-ganjar,2023-10-11,False
Strategi Pendekatan Prabowo ke Jokowi Dinilai Buat PDIP Ketar-ketir,/read/K5nC4Zy7-strategi-pendekatan-prabowo-ke-jokowi-dinilai-buat-pdip-ketar-ketir,2023-10-11,False
PPP Datangi Rumah Aspirasi Ganjar Pranowo,/play/b7WCRL8J-ppp-datangi-rumah-aspirasi-ganjar-pranowo,2023-10-11,False
Emak-Emak di Surabaya Minta Ganjar Perjuangkan Hak Perempuan,/play/NP6CZq1v-emak-emak-di-surabaya-minta-ganjar-perjuangkan-hak-perempuan,2023-10-11,False
Indonesia Dinilai Perlu Nakhoda Andal untuk Lanjutkan Kepemimpinan Jokowi,/read/NG9C5Med-indonesia-dinilai-perlu-nakhoda-andal-untuk-lanjutkan-kepemimpinan-jokowi,2023-10-11,False
PPP soal Bakal Cawapres Ganjar: Kita Tunggu Saja,/play/KYVCJo4Q-ppp-soal-bakal-cawapres-ganjar-kita-tunggu-saja,2023-10-11,False
"Erick Thohir Mendadak Temui Ganjar Pranowo, Bahas Pilpres?",/play/bw6CYEo6-erick-thohir-mendadak-temui-ganjar-pranowo-bahas-pilpres,2023-10-11,False
Usulan Jokowi Bertemu 3 Bacapres Diyakini Tak Terwujud,/read/K5nC4ZXy-usulan-jokowi-bertemu-3-bacapres-diyakini-tak-terwujud,2023-10-11,False
Respons NasDem Soal Usulan Jokowi Bertemu 3 Bacapres,/read/k8oCLz9o-respons-nasdem-soal-usulan-jokowi-bertemu-3-bacapres,2023-10-11,False
Menpora Dorong Stadion Manahan Jadi Venue Piala Dunia U-17,/read/b2lCrQoY-menpora-dorong-stadion-manahan-jadi-venue-piala-dunia-u-17,2023-10-11,False
Bakal Cawapres Ganjar Diumumkan September 2023,/play/NG9C5MrW-bakal-cawapres-ganjar-diumumkan-september-2023,2023-10-11,False
PAN Sodorkan Erick Thohir ke Prabowo dan Ganjar,/play/K5nC4ZDe-pan-sodorkan-erick-thohir-ke-prabowo-dan-ganjar,2023-10-11,False
"Ajukan Sandiaga Cawapres Ganjar, PPP Tunggu Keputusan Megawati",/read/N0BCrZ7Z-ajukan-sandiaga-cawapres-ganjar-ppp-tunggu-keputusan-megawati,2023-10-11,False
Kapolri Tak Hadiri Acara HUT Persatuan Purnawirawan  Polri,/read/b7WCRL6x-kapolri-tak-hadiri-acara-hut-persatuan-purnawirawan-polri,2023-10-11,False
"Wacana Jokowi Undang Anies, Ganjar, dan Prabowo Disambut Positif",/read/K5nC4ZQ5-wacana-jokowi-undang-anies-ganjar-dan-prabowo-disambut-positif,2023-10-11,False
Ketua Kadin Arsjad Rasjid Masuk Bursa Timses Ganjar Pranowo,/play/kewClYJG-ketua-kadin-arsjad-rasjid-masuk-bursa-timses-ganjar-pranowo,2023-10-11,False
Ini Isi Bisikan Megawati kepada Mahfud di Resepsi Pernikahan,/read/KZmCvyZL-ini-isi-bisikan-megawati-kepada-mahfud-di-resepsi-pernikahan,2023-10-11,False
Sahabat Ganjar Sukses Gelar Pesta Rakyat di Magelang,/play/kpLCrmwl-sahabat-ganjar-sukses-gelar-pesta-rakyat-di-magelang,2023-10-11,False
"Bertemu Ganjar saat Berhaji, Anies Lapor ke Koalisi Perubahan",/read/k8oCLEPY-bertemu-ganjar-saat-berhaji-anies-lapor-ke-koalisi-perubahan,2023-10-11,False
Aturan Sosialisasi Pemilu Dinilai Penting untuk Akuntabilitas Dana Kampanye,/read/KvJCB6dL-aturan-sosialisasi-pemilu-dinilai-penting-untuk-akuntabilitas-dana-kampanye,2023-10-11,False
Publik Diajak Mengawasi Manuver Elite Politik Jelang Pemilu,/read/NOlCYvdG-publik-diajak-mengawasi-manuver-elite-politik-jelang-pemilu,2023-10-11,False
