Judul Artikel,Link,Waktu_Scraping,Berita_Hoax
Saling Tunggu Jadi Strategi Tiga Koalisi Umumkan Capres Cawapres,/read/KZmCvO9e-saling-tunggu-jadi-strategi-tiga-koalisi-umumkan-capres-cawapres,2023-10-11,False
Jokowi dan Prabowo Dinilai Beri Contoh Persatuan di Indonesia,/read/kqYCE6ej-jokowi-dan-prabowo-dinilai-beri-contoh-persatuan-di-indonesia,2023-10-11,False
Jokowi Panggil Prabowo dan Habib Luthfi Bahas Muktamar Sufi Internasional,/read/N0BCrnP3-jokowi-panggil-prabowo-dan-habib-luthfi-bahas-muktamar-sufi-internasional,2023-10-11,False
Begini Respons Prabowo Tanggapi Beberapa Hasil Survei,/read/NnjC7yO4-begini-respons-prabowo-tanggapi-beberapa-hasil-survei,2023-10-11,False
Yenny Wahid Mengaku Punya Kedekatan Khusus dengan Anies,/read/k8oCLdPr-yenny-wahid-mengaku-punya-kedekatan-khusus-dengan-anies,2023-10-11,False
Suara Kader PSI Dinilai Terbelah Usai Prabowo Bertandang,/read/NrWCZ667-suara-kader-psi-dinilai-terbelah-usai-prabowo-bertandang,2023-10-11,False
Anies Dinilai Perlu Rebut Hati Pemilih Jokowi,/read/bJECnemW-anies-dinilai-perlu-rebut-hati-pemilih-jokowi,2023-10-11,False
Prabowo: Kritikan Rocky Gerung ke Presiden Jokowi Keliru,/play/N9nC63V8-prabowo-kritikan-rocky-gerung-ke-presiden-jokowi-keliru,2023-10-11,False
3 Personel Polri Lulusan Terbaik Beasiswa Turki Diganjar Penghargaan,/read/NA0CXRoX-3-personel-polri-lulusan-terbaik-beasiswa-turki-diganjar-penghargaan,2023-10-11,False
Guntur Romli: PSI & Prabowo Sepakat Kerja Sama di Pilpres 2024,/play/kM6C06oJ-guntur-romli-psi-prabowo-sepakat-kerja-sama-di-pilpres-2024,2023-10-11,False
"Dampak Kunjungan Prabowo, PSI Mulai Ditinggalkan Kadernya",/read/NnjC7y0j-dampak-kunjungan-prabowo-psi-mulai-ditinggalkan-kadernya,2023-10-11,False
Prabowo Subianto Hadiri Jalan Sehat di Makassar,/play/b7WCRQj5-prabowo-subianto-hadiri-jalan-sehat-di-makassar,2023-10-11,False
Bukti-bukti Kasus Rocky Gerung Dilimpahkan ke Bareskrim,/read/kqYCE6Wy-bukti-bukti-kasus-rocky-gerung-dilimpahkan-ke-bareskrim,2023-10-11,False
Polisi Tangkap Warga Papua Nugini Sindikat Jaringan Internasional Penyelundup Ganja,/read/kqYCE6PE-polisi-tangkap-warga-papua-nugini-sindikat-jaringan-internasional-penyelundup-ganja,2023-10-11,False
"BNI Sekuritas Bukukan Total Revenue Rp145,4 Miliar di Semester I-2023",/read/KYVCJ2B8-bni-sekuritas-bukukan-total-revenue-rp145-4-miliar-di-semester-i-2023,2023-10-11,False
Penyebab Kebakaran Kantor KPU di Yahukimo Ditelusuri,/read/bVDCOZ1w-penyebab-kebakaran-kantor-kpu-di-yahukimo-ditelusuri,2023-10-11,False
"Sikap Mau Merangkul Lawan, Prabowo Dinilai Sosok Negarawan",/read/kpLCre8r-sikap-mau-merangkul-lawan-prabowo-dinilai-sosok-negarawan,2023-10-11,False
Kuasa Hukum Sultan: Kami Akan Proses Hukum!,/read/NG9C516r-kuasa-hukum-sultan-kami-akan-proses-hukum,2023-10-11,False
"Ada Prabowo, Ada ""Semut""",/play/NgxC8oJn-ada-prabowo-ada-semut,2023-10-11,False
"Ultimatum PKB untuk Prabowo Subianto: Elu Enggak Jelas, Gue Lepas",/play/kWDCOXxa-ultimatum-pkb-untuk-prabowo-subianto-elu-enggak-jelas-gue-lepas,2023-10-11,False
Rencana Prabowo Rangkul Semua Pihak ke Pemerintahan Berbahaya bagi Demokrasi,/read/bmRCmzje-rencana-prabowo-rangkul-semua-pihak-ke-pemerintahan-berbahaya-bagi-demokrasi,2023-10-11,False
Kader PSI Mundur Buntut Kunjungan Prabowo,/play/b2lCrajd-kader-psi-mundur-buntut-kunjungan-prabowo,2023-10-11,False
"Meski Dua Kali Jadi Rival, Prabowo Bangga dengan Kepemimpinan Jokowi",/read/KdZCVwLw-meski-dua-kali-jadi-rival-prabowo-bangga-dengan-kepemimpinan-jokowi,2023-10-11,False
Ganjar Ungkap Cak Nun Sudah Pindah dari Ruang ICU,/read/K5nC4Wwl-ganjar-ungkap-cak-nun-sudah-pindah-dari-ruang-icu,2023-10-11,False
Ahli Sebut Polri Harus Pertemukan Rocky Gerung dengan Jokowi,/read/NLMCOdDQ-ahli-sebut-polri-harus-pertemukan-rocky-gerung-dengan-jokowi,2023-10-11,False
PKS Hargai Pilihan Golkar yang Tak Mungkin Dukung Anies,/read/NrWCZ6Gv-pks-hargai-pilihan-golkar-yang-tak-mungkin-dukung-anies,2023-10-11,False
Muhaimin Sebut Gibran Belum Masuk Radar Cawapres Prabowo,/read/NA0CXR83-muhaimin-sebut-gibran-belum-masuk-radar-cawapres-prabowo,2023-10-11,False
Pesan Teddy Minahasa Usai Banding PDTH Ditolak,/read/NP6CZ81y-pesan-teddy-minahasa-usai-banding-pdth-ditolak,2023-10-11,False
Respons Kubu Teddy Usai Banding PDTH Ditolak,/read/k8oCLdaY-respons-kubu-teddy-usai-banding-pdth-ditolak,2023-10-11,False
Prabowo Undang Deddy Corbuzier hingga Bintang Emon ke Kantor Kemenhan,/play/b3JCyzAB-prabowo-undang-deddy-corbuzier-hingga-bintang-emon-ke-kantor-kemenhan,2023-10-11,False
"Digoda PDIP, Cak Imin: Kalau Sudah Tak Ada Harapan Ya Ikut",/read/K5nC4WGA-digoda-pdip-cak-imin-kalau-sudah-tak-ada-harapan-ya-ikut,2023-10-11,False
Korban Jeratan Kabel Optik Dirawat di Rumah Sakit Polri,/read/N9nC63YG-korban-jeratan-kabel-optik-dirawat-di-rumah-sakit-polri,2023-10-11,False
Rocky Gerung Kritik Pernyataan Moeldoko Soal Pasang Badan untuk Jokowi,/read/KYVCJ2ya-rocky-gerung-kritik-pernyataan-moeldoko-soal-pasang-badan-untuk-jokowi,2023-10-11,False
"Prabowo Lambat Deklarasi, Cak Imin Diminta Cari Kejelasan",/read/b3JCyzxB-prabowo-lambat-deklarasi-cak-imin-diminta-cari-kejelasan,2023-10-11,False
PDIP Bantah Mundurnya Effendi Simbolon Sebagai Bacaleg Gara-gara Dukung Prabowo,/read/kewCl96m-pdip-bantah-mundurnya-effendi-simbolon-sebagai-bacaleg-gara-gara-dukung-prabowo,2023-10-11,False
Ulin Yusron: Jokowi Risih Namanya Dijual,/read/NgxC8opw-ulin-yusron-jokowi-risih-namanya-dijual,2023-10-11,False
Polisi Tangani 13 Kasus Pelaporan Rocky Gerung,/read/bJECneoD-polisi-tangani-13-kasus-pelaporan-rocky-gerung,2023-10-11,False
Ulin Yusron Klaim Jokowi tidak Ingin Isu Gibran Cawapres Lukai Reformasi 1998,/read/b7WCRQxP-ulin-yusron-klaim-jokowi-tidak-ingin-isu-gibran-cawapres-lukai-reformasi-1998,2023-10-11,False
Jokowi Diyakini Lebih 'Berat' kepada Ganjar dibanding Prabowo,/read/k8oCLdrz-jokowi-diyakini-lebih-berat-kepada-ganjar-dibanding-prabowo,2023-10-11,False
Pesawat Smart Air Tergelincir di Kenyam Papua,/read/K5nC4WMa-pesawat-smart-air-tergelincir-di-kenyam-papua,2023-10-11,False
PSI Usai Bertemu Prabowo: Kompas Kami adalah Pak Jokowi,/play/kM6C060a-psi-usai-bertemu-prabowo-kompas-kami-adalah-pak-jokowi,2023-10-11,False
"Usut Aliran Dana Fiktif PT Amarta Karya, KPK Periksa Dirut AirNav Indonesia",/read/b2lCraOn-usut-aliran-dana-fiktif-pt-amarta-karya-kpk-periksa-dirut-airnav-indonesia,2023-10-11,False
Airlangga Bakal Bahas Arah Dukungan Golkar dengan Para Senior,/read/NxGC5MyD-airlangga-bakal-bahas-arah-dukungan-golkar-dengan-para-senior,2023-10-11,False
Pemerintah Komitmen Dukung Kemandirian Industri Pertahanan Indonesia,/read/b3JCyzVn-pemerintah-komitmen-dukung-kemandirian-industri-pertahanan-indonesia,2023-10-11,False
Survei: Prabowo Lebih Unggul Bila Berpasangan dengan Erick Ketimbang Cak Imin di Sumbar,/read/NxGC5MyP-survei-prabowo-lebih-unggul-bila-berpasangan-dengan-erick-ketimbang-cak-imin-di-sumbar,2023-10-11,False
Gibran Ogah Tanggapi Kode Cawapres dari Prabowo,/read/KXyC9q0Y-gibran-ogah-tanggapi-kode-cawapres-dari-prabowo,2023-10-11,False
Survei: Suara Ganjar di Sumatra Barat Bisa Terdistribusi ke Anies,/read/bzGCgdXa-survei-suara-ganjar-di-sumatra-barat-bisa-terdistribusi-ke-anies,2023-10-11,False
Survei: Anies Unggul atas Ganjar di Sumatra Barat,/read/bJECneYB-survei-anies-unggul-atas-ganjar-di-sumatra-barat,2023-10-11,False
Gibran Bantah Arahkan Relawan Laporkan Rocky Gerung,/read/NleC0dGB-gibran-bantah-arahkan-relawan-laporkan-rocky-gerung,2023-10-11,False
Laporan Pendamping Program PKH Didalami KPK,/read/koGCVLyl-laporan-pendamping-program-pkh-didalami-kpk,2023-10-11,False
"Ogah Kalah 3 Kali, PAN Tak Mau Gegabah Pilih Capres",/read/bD2CZXgQ-ogah-kalah-3-kali-pan-tak-mau-gegabah-pilih-capres,2023-10-11,False
"Gantikan Effendi Simbolon, Ferdinand Hutahaean Nyaleg dari PDIP",/read/bmRCmzw6-gantikan-effendi-simbolon-ferdinand-hutahaean-nyaleg-dari-pdip,2023-10-11,False
"Disebut Makan Rayuan Gombal Oleh Politisi Senior PDIP, Ini Tanggapan Gibran",/read/KRXCa104-disebut-makan-rayuan-gombal-oleh-politisi-senior-pdip-ini-tanggapan-gibran,2023-10-11,False
PKB Tak Mau Ikut Campur Syarat PAN Soal Erick Thohir,/read/Ky6CBQZQ-pkb-tak-mau-ikut-campur-syarat-pan-soal-erick-thohir,2023-10-11,False
"Korupsi Komoditi Emas, Kejagung Selisik Dugaan Perbuatan Melawan Hukum UBS dan IGS",/read/KvJCBG5E-korupsi-komoditi-emas-kejagung-selisik-dugaan-perbuatan-melawan-hukum-ubs-dan-igs,2023-10-11,False
"Bertemu Raffi Ahmad, Prabowo Dinilai Dapat Suntikan Elektoral",/read/kELC1AoL-bertemu-raffi-ahmad-prabowo-dinilai-dapat-suntikan-elektoral,2023-10-11,False
PSI Dinilai Berharap Berkoalisi dengan Gerindra,/read/N9nC63eR-psi-dinilai-berharap-berkoalisi-dengan-gerindra,2023-10-11,False
PPP Salut Gerindra Bisa Buka Komunikasi dengan PSI,/read/ba4C0Lro-ppp-salut-gerindra-bisa-buka-komunikasi-dengan-psi,2023-10-11,False
Prabowo: Gerindra dan PSI Sefrekuensi,/play/N9nC63zd-prabowo-gerindra-dan-psi-sefrekuensi,2023-10-11,False
PKB Duga Ada 'Invisible Hand' dalam Penentuan Pendamping Prabowo,/play/N0BCrnxD-pkb-duga-ada-invisible-hand-dalam-penentuan-pendamping-prabowo,2023-10-11,False
Partai Gelora Dukung Prabowo,/read/bVDCOZJO-partai-gelora-dukung-prabowo,2023-10-11,False
"Diamuk Mak-Mak, Polda Jatim Sebut Pembuatan SIM Sesuai Aturan",/read/kWDCOXj4-diamuk-mak-mak-polda-jatim-sebut-pembuatan-sim-sesuai-aturan,2023-10-11,False
Pemilihan Cawapres Diyakini Alot karena Kental Muatan Transaksional,/read/K5nC4WYg-pemilihan-cawapres-diyakini-alot-karena-kental-muatan-transaksional,2023-10-11,False
PAN Tetapkan Syarat Khusus Dukung Ganjar atau Prabowo,/read/k8oCLd3J-pan-tetapkan-syarat-khusus-dukung-ganjar-atau-prabowo,2023-10-11,False
"PSI Dikabarkan Bakal Gabung Dukung Prabowo, PKB: Makin Banyak Bergabung Lebih Baik",/read/NxGC5Mq3-psi-dikabarkan-bakal-gabung-dukung-prabowo-pkb-makin-banyak-bergabung-lebih-baik,2023-10-11,False
Idrus Marham Sebut DPD I Golkar Diminta Airlangga Dukung Prabowo,/read/N6GC8QeW-idrus-marham-sebut-dpd-i-golkar-diminta-airlangga-dukung-prabowo,2023-10-11,False
"Terima Kunjungan PDIP dan DPD Dukung Prabowo, Golkar Disebut Main Akrobat",/read/bw6CYD6o-terima-kunjungan-pdip-dan-dpd-dukung-prabowo-golkar-disebut-main-akrobat,2023-10-11,False
"Sore Ini, Prabowo Berencana Datangi Markas PSI",/read/NgxC8oMa-sore-ini-prabowo-berencana-datangi-markas-psi,2023-10-11,False
Wapres Panggil Menkopolhukam hingga Panglima TNI Bahas Kelaparan di Papua Tengah,/read/N6GC8Mzl-wapres-panggil-menkopolhukam-hingga-panglima-tni-bahas-kelaparan-di-papua-tengah,2023-10-11,False
Momen Prabowo dan Raffi Ahmad Makan Siang Bersama,/play/bVDCOoe4-momen-prabowo-dan-raffi-ahmad-makan-siang-bersama,2023-10-11,False
2 Anggota KKB Tewas dalam Penggerebekan di Yahukimo,/read/b3JCyq13-2-anggota-kkb-tewas-dalam-penggerebekan-di-yahukimo,2023-10-11,False
"Janji Setia dengan KKIR, PKB Ngotot Cak Imin Harus Cawapres",/read/Ky6CBV3A-janji-setia-dengan-kkir-pkb-ngotot-cak-imin-harus-cawapres,2023-10-11,False
Pos BKO Brimob di Yahukimo Diserang KKB,/read/NrWCZ01o-pos-bko-brimob-di-yahukimo-diserang-kkb,2023-10-11,False
Pencabutan KJP Pelajar Johar Baru Dipastikan Sesuai Prosedur,/read/NxGC5JM2-pencabutan-kjp-pelajar-johar-baru-dipastikan-sesuai-prosedur,2023-10-11,False
Survei: Prabowo Makin Unggul dari Ganjar,/play/kM6C0552-survei-prabowo-makin-unggul-dari-ganjar,2023-10-11,False
Prabowo Minta Cak Imin Tak Keluar dari Koalisi,/play/kqYCE88R-prabowo-minta-cak-imin-tak-keluar-dari-koalisi,2023-10-11,False
Keamanan Data Jadi Aset Penting Perusahaan,/read/k8oCLjj5-keamanan-data-jadi-aset-penting-perusahaan,2023-10-11,False
Pengamat: JK Ingin Golkar Perkuat Poros Pendukung Anies,/read/N4EC2Pga-pengamat-jk-ingin-golkar-perkuat-poros-pendukung-anies,2023-10-11,False
Elektabilitas Prabowo Dinilai Terkait Dukungan Milenial,/read/Ky6CBVp9-elektabilitas-prabowo-dinilai-terkait-dukungan-milenial,2023-10-11,False
Gus Min Bikin Prabowo Cemas,/play/KvJCBXdl-gus-min-bikin-prabowo-cemas,2023-10-11,False
Persaingan Sengit Tiket Cawapres,/read/b3JCyq0m-persaingan-sengit-tiket-cawapres,2023-10-11,False
Belum Diketahui Wakil Indonesia yang akan ke Dialog Damai Rusia-Ukraina,/read/NxGC5J79-belum-diketahui-wakil-indonesia-yang-akan-ke-dialog-damai-rusia-ukraina,2023-10-11,False
Polri Selamatkan 2.221 Korban TPPO dalam Sebulan,/read/K5nC4oZj-polri-selamatkan-2-221-korban-tppo-dalam-sebulan,2023-10-11,False
LSI: Prabowo Mendominasi Jabar hingga Jatim,/read/b2lCrln9-lsi-prabowo-mendominasi-jabar-hingga-jatim,2023-10-11,False
"4 Blunder Ganjar, dari U-19 hingga Cawe-cawe di DKI",/read/N9nC6Vrw-4-blunder-ganjar-dari-u-19-hingga-cawe-cawe-di-dki,2023-10-11,False
"Prabowo Butuh Penguatan Cawapres, Anies Dinilai Dapat Dipertimbangkan",/read/kWDCO8gX-prabowo-butuh-penguatan-cawapres-anies-dinilai-dapat-dipertimbangkan,2023-10-11,False
Survei LSI Beberkan 4 Blunder Ganjar Pranowo,/read/KYVCJAvw-survei-lsi-beberkan-4-blunder-ganjar-pranowo,2023-10-11,False
Prabowo Berpesan Cak Imin Jangan ke Mana-Mana,/play/NQAC2dr4-prabowo-berpesan-cak-imin-jangan-ke-mana-mana,2023-10-11,False
Survei: Elektabilitas Prabowo Semakin Jauh Tinggalkan Ganjar,/read/NxGC5J9Y-survei-elektabilitas-prabowo-semakin-jauh-tinggalkan-ganjar,2023-10-11,False
JK: Pencarian Cawapres Sekarang Kebanyakan Negosiasi,/read/b2lCrlgv-jk-pencarian-cawapres-sekarang-kebanyakan-negosiasi,2023-10-11,False
JK Singgung Kemenangan Donald Trump Merespons Elektabilitas Anies,/read/KXyC9J3R-jk-singgung-kemenangan-donald-trump-merespons-elektabilitas-anies,2023-10-11,False
PBB Resmi Deklarasi Dukung Prabowo di Pilpres 2024,/play/kWDCO8wr-pbb-resmi-deklarasi-dukung-prabowo-di-pilpres-2024,2023-10-11,False
PDIP Dinilai Beri Harapan Palsu ke AHY dan Cak Imin,/read/kBVC2GQl-pdip-dinilai-beri-harapan-palsu-ke-ahy-dan-cak-imin,2023-10-11,False
PBB Dukung Prabowo Subianto sebagai Bacapres 2024,/read/koGCVp2Y-pbb-dukung-prabowo-subianto-sebagai-bacapres-2024,2023-10-11,False
Pimpinan KPK Dinilai Amatir dalam Kasus Korupsi di Basarnas,/read/b2lCrljx-pimpinan-kpk-dinilai-amatir-dalam-kasus-korupsi-di-basarnas,2023-10-11,False
Ketum PBB Yusril Ihza Yakin Prabowo Menang di Pilpres 2024,/play/bD2CZDPB-ketum-pbb-yusril-ihza-yakin-prabowo-menang-di-pilpres-2024,2023-10-11,False
Prabowo Apresiasi Dukungan Partai Bulan Bintang,/play/bmRCmPj7-prabowo-apresiasi-dukungan-partai-bulan-bintang,2023-10-11,False
PBB Deklarasikan Dukung Prabowo Subianto di Pilpres 2024,/play/K5nC4oqP-pbb-deklarasikan-dukung-prabowo-subianto-di-pilpres-2024,2023-10-11,False
Jokowi Minta Partai Politik Jaga Kualitas Pemilu 2024,/read/NrWCZ0vB-jokowi-minta-partai-politik-jaga-kualitas-pemilu-2024,2023-10-11,False
Adu Rayu Anies vs Prabowo,/play/kj2CAljW-adu-rayu-anies-vs-prabowo,2023-10-11,False
Ganjar Respons Pernyataan Prabowo Terkait Persaingan Sehat Pilpres 2024,/read/N9nC6VB3-ganjar-respons-pernyataan-prabowo-terkait-persaingan-sehat-pilpres-2024,2023-10-11,False
Prabowo: Arah Pendidikan Indonesia Sudah Benar,/play/NgxC8yZz-prabowo-arah-pendidikan-indonesia-sudah-benar,2023-10-11,False
"Prabowo Peluk Ganjar, Sampaikan Persaingan Mesti Sehat",/read/bzGCgqMG-prabowo-peluk-ganjar-sampaikan-persaingan-mesti-sehat,2023-10-11,False
Pertemuan Tak Direncanakan Prabowo-Ganjar,/read/bD2CZDYL-pertemuan-tak-direncanakan-prabowo-ganjar,2023-10-11,False
"Usai Lawatan ke Tiongkok, Presiden Jokowi Tiba di Tanah Air",/read/bw6CYlX7-usai-lawatan-ke-tiongkok-presiden-jokowi-tiba-di-tanah-air,2023-10-11,False
"Golkar Bimbang, Mau ke Prabowo atau Ganjar?",/play/NxGC5JnB-golkar-bimbang-mau-ke-prabowo-atau-ganjar,2023-10-11,False
Mantan Aktivis PRD Kecewa Budiman Sudjatmiko Temui Prabowo,/play/KXyC9JPy-mantan-aktivis-prd-kecewa-budiman-sudjatmiko-temui-prabowo,2023-10-11,False
Kapolri dan Panglima Pilih Metode Ini Tangkal Terorisme Jelang Pemilu,/read/NgxC8yq5-kapolri-dan-panglima-pilih-metode-ini-tangkal-terorisme-jelang-pemilu,2023-10-11,False
Anies dan Prabowo Sampaikan Gagasan Pembangunan Desa di Jambi,/play/NnjC7E29-anies-dan-prabowo-sampaikan-gagasan-pembangunan-desa-di-jambi,2023-10-11,False
"Wapres Sebut Gerakan Radikal Tumbuh Subur Jelang Pemilu 2024, BNPT Diminta Perketat Pengawasan Medsos",/read/bmRCmPXP-wapres-sebut-gerakan-radikal-tumbuh-subur-jelang-pemilu-2024-bnpt-diminta-perketat-pengawasan-medsos,2023-10-11,False
Gerindra Sebut Ucapan Puan ke Cak Imin soal 11 Bulan Koaliasi Cuma Gimik,/read/KXyC9JWO-gerindra-sebut-ucapan-puan-ke-cak-imin-soal-11-bulan-koaliasi-cuma-gimik,2023-10-11,False
Pede,/read/kpLCrdrR-pede,2023-10-11,False
PKB Gerah PAN Kasak-kusuk Duetkan Prabowo-Erick,/play/b3JCyqrV-pkb-gerah-pan-kasak-kusuk-duetkan-prabowo-erick,2023-10-11,False
RS Swasta DIY Kesulitan Buang Sampah Domestik,/read/k8oCLjLv-rs-swasta-diy-kesulitan-buang-sampah-domestik,2023-10-11,False
Lembaga Survei Australia Soroti Kompetisi Ketat Pilpres Indonesia,/read/b3JCyqV4-lembaga-survei-australia-soroti-kompetisi-ketat-pilpres-indonesia,2023-10-11,False
Parpol Diminta Komitmen Ikut Perangi Hoaks,/read/b1oC8RA8-parpol-diminta-komitmen-ikut-perangi-hoaks,2023-10-11,False
Cak Imin Sebut PDIP Sudah Seperti Keluarga,/read/b2lCrlZl-cak-imin-sebut-pdip-sudah-seperti-keluarga,2023-10-11,False
Hasto Bantah Kader PDIP Pindah Dukung Prabowo,/read/NxGC5JO7-hasto-bantah-kader-pdip-pindah-dukung-prabowo,2023-10-11,False
Cak Imin Laporkan Godaan PDIP kepada Prabowo,/read/bVDCOowQ-cak-imin-laporkan-godaan-pdip-kepada-prabowo,2023-10-11,False
Puan Goda Cak Imin Dukung Ganjar,/read/b2lCrlol-puan-goda-cak-imin-dukung-ganjar,2023-10-11,False
PDIP Hormati Koalisi PKB dan Gerindra yang Sudah Terjalin 11 Bulan,/read/KRXCaX0x-pdip-hormati-koalisi-pkb-dan-gerindra-yang-sudah-terjalin-11-bulan,2023-10-11,False
PDIP Klaim Tak Bicara Persyaratan Koalisi dengan PKB,/read/NLMCOowB-pdip-klaim-tak-bicara-persyaratan-koalisi-dengan-pkb,2023-10-11,False
PAN Sebut Duet Prabowo-Erick Sudah Dibahas dengan Gerindra dan PKB,/read/bJECnmvY-pan-sebut-duet-prabowo-erick-sudah-dibahas-dengan-gerindra-dan-pkb,2023-10-11,False
"Budiman Perlihatlan Dukung Prabowo, Sejumlah Aktivis 98 Kecewa",/read/ba4C0Raj-budiman-perlihatlan-dukung-prabowo-sejumlah-aktivis-98-kecewa,2023-10-11,False
Kapolri Dinilai Sudah Gerak Cepat Merespons Kasus Polisi Tembak Polisi,/read/NQAC2dJr-kapolri-dinilai-sudah-gerak-cepat-merespons-kasus-polisi-tembak-polisi,2023-10-11,False
Analis Sebut Kemesraan Prabowo-Erick Gimik,/play/k8oCLjny-analis-sebut-kemesraan-prabowo-erick-gimik,2023-10-11,False
Anies-Prabowo Adu Gagasan di Rakernas Apdesi,/play/kELC1voQ-anies-prabowo-adu-gagasan-di-rakernas-apdesi,2023-10-11,False
Adu Mesra Prabowo-Erick dan Anies-Susi,/play/KZmCv2qP-adu-mesra-prabowo-erick-dan-anies-susi,2023-10-11,False
Relawan Anies Baswedan Dorong Uji Publik Antarcapres,/read/b1oC8Rzd-relawan-anies-baswedan-dorong-uji-publik-antarcapres,2023-10-11,False
"Khawatir Ada Bawaslu, Prabowo Hati-Hati Bicara di Rakernas Apdesi 2023",/play/bVDCOo36-khawatir-ada-bawaslu-prabowo-hati-hati-bicara-di-rakernas-apdesi-2023,2023-10-11,False
Prabowo Ungkit Jasanya Perjuangkan Dana Desa Rp1 Miliar,/play/KXyC9Jp1-prabowo-ungkit-jasanya-perjuangkan-dana-desa-rp1-miliar,2023-10-11,False
Relawan Anies Baswedan tak Terusik Hasil Survei,/read/kELC1vWd-relawan-anies-baswedan-tak-terusik-hasil-survei,2023-10-11,False
Erick Refute Issues Ahok becoming CEO’s of Pertamina,/read/NQAC2d6l-erick-refute-issues-ahok-becoming-ceo-s-of-pertamina,2023-10-11,False
"Di Forum Apdesi, Prabowo Kembali Lontarkan Pujian untuk Jokowi",/play/N6GC8MRj-di-forum-apdesi-prabowo-kembali-lontarkan-pujian-untuk-jokowi,2023-10-11,False
"Survei LSN: Elektabilitas Prabowo Teratas, Anies Meningkat",/read/KdZCVG6q-survei-lsn-elektabilitas-prabowo-teratas-anies-meningkat,2023-10-11,False
847 Suspects Arrested on Human Trafficking Case,/read/K5nC4o8O-847-suspects-arrested-on-human-trafficking-case,2023-10-11,False
Respons Erick Thohir Tanggapi Kabar Ahok Jadi Dirut Pertamina,/read/bmRCmPr2-respons-erick-thohir-tanggapi-kabar-ahok-jadi-dirut-pertamina,2023-10-11,False
"Masih Dirawat, RSUP Dr Sardjito Bantah Kabar Cak Nun Meninggal",/read/bD2CZD78-masih-dirawat-rsup-dr-sardjito-bantah-kabar-cak-nun-meninggal,2023-10-11,False
PKB Peringatkan PAN Bicara Langsung Soal Duet Prabowo-Erick,/read/b3JCy642-pkb-peringatkan-pan-bicara-langsung-soal-duet-prabowo-erick,2023-10-11,False
Presiden Jokowi Lantik 833 Perwira Remaja TNI dan Polri,/read/NxGC5Lry-presiden-jokowi-lantik-833-perwira-remaja-tni-dan-polri,2023-10-11,False
"Ditanya soal Cawapres, Prabowo Tertawa Sambil Rangkul Erick Thohir",/play/K5nC4o2J-ditanya-soal-cawapres-prabowo-tertawa-sambil-rangkul-erick-thohir,2023-10-11,False
PAN Klaim Jokowi Beri Kode Keras pada Pasangan Prabowo-Erick,/read/kM6C0Pme-pan-klaim-jokowi-beri-kode-keras-pada-pasangan-prabowo-erick,2023-10-11,False
"847 Tersangka TPPO Ditangkap, 2.176 Korban Diselamatkan",/read/bw6CYOrP-847-tersangka-tppo-ditangkap-2-176-korban-diselamatkan,2023-10-11,False
Dukungan Gen Z Jadi Lompatan Elektabilitas Prabowo,/read/b7WCRoPp-dukungan-gen-z-jadi-lompatan-elektabilitas-prabowo,2023-10-11,False
Cak Imin dan Prabowo Disebut Tak Peduli Deadline Ulama Soal Pengumuman Cawapres,/read/NnjC7PGR-cak-imin-dan-prabowo-disebut-tak-peduli-deadline-ulama-soal-pengumuman-cawapres,2023-10-11,False
Anies Ibarat Kuda Hitam antara Prabowo Vs Ganjar,/play/bmRCmdRL-anies-ibarat-kuda-hitam-antara-prabowo-vs-ganjar,2023-10-11,False
Menilik Masa Depan Peran Auditor Internal Bank,/read/bD2CZ62o-menilik-masa-depan-peran-auditor-internal-bank,2023-10-11,False
Gerindra Yakin PKB Setia Dukung Prabowo di Pilpres 2024,/play/koGCVnxB-gerindra-yakin-pkb-setia-dukung-prabowo-di-pilpres-2024,2023-10-11,False
Gibran Akui Satu Mobil dengan Prabowo Mengantar ke Bandara,/play/NQAC29e5-gibran-akui-satu-mobil-dengan-prabowo-mengantar-ke-bandara,2023-10-11,False
"Jika Tak Pilih Cak Imin sebagai Cawapres, PKB Menganggap Prabowo Berkhianat",/read/N6GC8ZMz-jika-tak-pilih-cak-imin-sebagai-cawapres-pkb-menganggap-prabowo-berkhianat,2023-10-11,False
PDIP Diyakini Tak Akan Masukkan Muhaimin Sebagai Kandidat Cawapres Ganjar Jika...,/read/NxGC5LLo-pdip-diyakini-tak-akan-masukkan-muhaimin-sebagai-kandidat-cawapres-ganjar-jika,2023-10-11,False
Respons PKB Soal Cak Imin Masuk Kandidat Cawapres Ganjar,/read/bJECnXG3-respons-pkb-soal-cak-imin-masuk-kandidat-cawapres-ganjar,2023-10-11,False
Presiden Jokowi Bantah Berikan 'Endorsement' ke Prabowo dan Erick Thohir,/play/NnjC7PjZ-presiden-jokowi-bantah-berikan-endorsement-ke-prabowo-dan-erick-thohir,2023-10-11,False
PBB Dukung Prabowo di Pilpres 2024,/play/NQAC29a7-pbb-dukung-prabowo-di-pilpres-2024,2023-10-11,False
Momen Prabowo Sopiri Jokowi di PT Pindad,/play/NA0CXWdQ-momen-prabowo-sopiri-jokowi-di-pt-pindad,2023-10-11,False
Prabowo-Erick Dampingi Jokowi Blusukan ke Pasar Bululawang,/play/KZmCv7DJ-prabowo-erick-dampingi-jokowi-blusukan-ke-pasar-bululawang,2023-10-11,False
Analis: Pertemuan Prabowo-Ganjar Jadi Upaya Jokowi agar Keberpihakannya Tidak Vulgar,/play/NrWCZne6-analis-pertemuan-prabowo-ganjar-jadi-upaya-jokowi-agar-keberpihakannya-tidak-vulgar,2023-10-11,False
"Soal Cak Imin Masuk Bursa Cawapres Ganjar, Gerindra: Pembicaraan Kami Masih Hangat",/read/kpLCr2jQ-soal-cak-imin-masuk-bursa-cawapres-ganjar-gerindra-pembicaraan-kami-masih-hangat,2023-10-11,False
Jokowi: Permintaan Peluru Buatan PT Pindad Meningkat,/read/Ky6CBp4m-jokowi-permintaan-peluru-buatan-pt-pindad-meningkat,2023-10-11,False
Gerindra Pilih Perkuat Koalisi Sebelum Cari Cawapres Prabowo,/read/NG9C5PpR-gerindra-pilih-perkuat-koalisi-sebelum-cari-cawapres-prabowo,2023-10-11,False
Jokowi Minta Daerah Siaga Hadapi El Nino dan Dampaknya,/read/N6GC8ZJL-jokowi-minta-daerah-siaga-hadapi-el-nino-dan-dampaknya,2023-10-11,False
Polri Serius Bentuk Direktorat Perlindungan Perempuan dan Anak,/read/k8oCLA8R-polri-serius-bentuk-direktorat-perlindungan-perempuan-dan-anak,2023-10-11,False
"Dukung Prabowo, PBB Klaim Kantongi Restu Jokowi",/read/KYVCJEBA-dukung-prabowo-pbb-klaim-kantongi-restu-jokowi,2023-10-11,False
Polisi Selamatkan 2.169 Korban TPPO,/read/bD2CZ6nR-polisi-selamatkan-2-169-korban-tppo,2023-10-11,False
PBB Tak Masalah Jika Cawapres Prabowo Bukan Yusril,/read/kM6C0PG8-pbb-tak-masalah-jika-cawapres-prabowo-bukan-yusril,2023-10-11,False
Elite Golkar Beberkan Potensi Airlangga Bentuk Poros Baru,/read/NnjC7PDA-elite-golkar-beberkan-potensi-airlangga-bentuk-poros-baru,2023-10-11,False
Kepala BNN Yakin Konsep Depenalisasi Kurangi Tahanan Narkoba,/read/koGCVnOL-kepala-bnn-yakin-konsep-depenalisasi-kurangi-tahanan-narkoba,2023-10-11,False
Presiden Ingin PT Pindad di Bandung Dipindah Secara Bertahap,/read/NxGC5LDj-presiden-ingin-pt-pindad-di-bandung-dipindah-secara-bertahap,2023-10-11,False
"Indikator Politik: Prabowo Unggul di Generasi Z, Milenial dan Baby Boomer",/play/K5nC4rjm-indikator-politik-prabowo-unggul-di-generasi-z-milenial-dan-baby-boomer,2023-10-11,False
"Momen Kebersamaan Prabowo, Ganjar, Erick dan Gibran di Solo",/play/NgxC8R2Q-momen-kebersamaan-prabowo-ganjar-erick-dan-gibran-di-solo,2023-10-11,False
Presiden Jokowi Sebut Ekspor Produk PT Pindad Meningkat Tajam,/read/N9nC6WPV-presiden-jokowi-sebut-ekspor-produk-pt-pindad-meningkat-tajam,2023-10-11,False
"Visiting Pindad, Jokowi Bring Along Prabowo and Erick Thohir",/read/NleC0vYm-visiting-pindad-jokowi-bring-along-prabowo-and-erick-thohir,2023-10-11,False
PBB Mantapkan Diri Dukung Prabowo,/read/kWDCOvGG-pbb-mantapkan-diri-dukung-prabowo,2023-10-11,False
Jokowi Ajak Prabowo dan Erick Thohir Kunjungan ke Pindad,/read/bD2CZ6B1-jokowi-ajak-prabowo-dan-erick-thohir-kunjungan-ke-pindad,2023-10-11,False
Presiden Pastikan Harga Kebutuhan Pokok di Malang Strabil,/read/NG9C5PBD-presiden-pastikan-harga-kebutuhan-pokok-di-malang-strabil,2023-10-11,False
Dewan Pakar Golkar Mendukung Langkah Airlangga Dekati Tiga Poros Capres,/read/b3JCy6GE-dewan-pakar-golkar-mendukung-langkah-airlangga-dekati-tiga-poros-capres,2023-10-11,False
