Judul Artikel,Link,Waktu_Scraping,Berita_Hoax
“Ratusan Kader Demokrat Sambut Anies Baswedan”,https://turnbackhoax.id/2023/09/21/salah-ratusan-kader-demokrat-sambut-anies-baswedan/,2023-10-11,True
Cak Imin dan Anies Jadi Tersangka Dugaan Korupsi Kemnaker,https://turnbackhoax.id/2023/09/18/salah-cak-imin-dan-anies-jadi-tersangka-dugaan-korupsi-kemnaker/,2023-10-11,True
Anies Baswedan Pimpin Demo di Rempang Batam,https://turnbackhoax.id/2023/09/18/salah-anies-baswedan-pimpin-demo-di-rempang-batam/,2023-10-11,True
MPR dan DPR Resmi Deklarasikan Anies – AHY Gantikan Jokowi,https://turnbackhoax.id/2023/09/15/salah-mpr-dan-dpr-resmi-deklarasikan-anies-ahy-gantikan-jokowi/,2023-10-11,True
"Pidato Amburadul, Anies Baswedan Gantikan Pidato Joko Widodo di KTT ASEAN 2023",https://turnbackhoax.id/2023/09/15/salah-pidato-amburadul-anies-baswedan-gantikan-pidato-joko-widodo-di-ktt-asean-2023/,2023-10-11,True
“PKS DAN DEMOKRAT TETAP DUKUNG ANIES DI PILPRES 2024”,https://turnbackhoax.id/2023/09/12/salah-pks-dan-demokrat-tetap-dukung-anies-di-pilpres-2024/,2023-10-11,True
“AHY DAN DEMOKRAT GERUDUK RUMAH ANIES BASWEDAN”,https://turnbackhoax.id/2023/09/08/salah-ahy-dan-demokrat-geruduk-rumah-anies-baswedan/,2023-10-11,True
Anies Baswedan Telah Ditahan Pada 28 Agustus 2023 Sore.,https://turnbackhoax.id/2023/09/07/salah-anies-baswedan-telah-ditahan-pada-28-agustus-2023-sore/,2023-10-11,True
Google Nobatkan Anies Baswedan Sebagai Gubernur Terbodoh,https://turnbackhoax.id/2023/08/31/salah-google-nobatkan-anies-baswedan-sebagai-gubernur-terbodoh/,2023-10-11,True
BUKTI KORUPSI ANIES DI BEBERKAN OLEH AHOK DI DEPAN PUBLIK?,https://turnbackhoax.id/2023/08/30/salah-bukti-korupsi-anies-di-beberkan-oleh-ahok-di-depan-publik/,2023-10-11,True
"2,3 TRILIUN DIGELAPKAN, KPK GERAK CEPAT JEMPUT PAKSA ANIES BASWEDAN",https://turnbackhoax.id/2023/08/29/salah-23-triliun-digelapkan-kpk-gerak-cepat-jemput-paksa-anies-baswedan/,2023-10-11,True
"Anies Positif Gagal Nyapres, Demokrat Resmi Hengkang",https://turnbackhoax.id/2023/08/28/salah-anies-positif-gagal-nyapres-demokrat-resmi-hengkang/,2023-10-11,True
Jokowi Memegang Gambar Anies Disertai Kalimat “PERUBAHAN INDONESIA”,https://turnbackhoax.id/2023/08/27/salah-jokowi-memegang-gambar-anies-disertai-kalimat-perubahan-indonesia/,2023-10-11,True
HERU BUDI BONGKAR KORUPSI ANIES DI DEPAN MEDIA,https://turnbackhoax.id/2023/08/27/salah-heru-budi-bongkar-korupsi-anies-di-depan-media/,2023-10-11,True
AKHIRNYA DIRESMIKAN !! DUWET ANIES-KHOFIFAH DIRESMIKAN LANGSUNG OLEH YENNY WAHID,https://turnbackhoax.id/2023/08/25/salah-akhirnya-diresmikan-duwet-anies-khofifah-diresmikan-langsung-oleh-yenny-wahid/,2023-10-11,True
MENGEJUTKAN ISTANA!! DUWET ANIES DAN SUSI AKHIRNYA DIRESMIKAN SURYA PALOH DAN PARPOL LAIN,https://turnbackhoax.id/2023/08/25/salah-mengejutkan-istana-duwet-anies-dan-susi-akhirnya-diresmikan-surya-paloh-dan-parpol-lain/,2023-10-11,True
AKHIRNYA !! NASDEM UMUMKAN CAWAPRES ANIES || YENNY WAHID RESMI GANDENG ANIES DI 2024,https://turnbackhoax.id/2023/08/25/salah-akhirnya-nasdem-umumkan-cawapres-anies-yenny-wahid-resmi-gandeng-anies-di-2024/,2023-10-11,True
DIRESMIKAN SORE INI !! YENNY WAHID SEPAKATI KHOFIFAH DAMPINGI ANIES 2024,https://turnbackhoax.id/2023/08/25/salah-diresmikan-sore-ini-yenny-wahid-sepakati-khofifah-dampingi-anies-2024/,2023-10-11,True
“RIBUAN WARGA SOLO PUTAR HALUAN DUKUNG ANIES DI PILPRES 2024”,https://turnbackhoax.id/2023/08/25/salah-ribuan-warga-solo-putar-haluan-dukung-anies-di-pilpres-2024/,2023-10-11,True
Gambar tangkapan layar artikel berjudul “Abah Aos Beri Jimat Jembut dari ‘Surga’untuk Anies Baswedan Agar Menang di Pilpres 2024”,https://turnbackhoax.id/2023/08/25/salah-gambar-tangkapan-layar-artikel-berjudul-abah-aos-beri-jimat-jembut-dari-surgauntuk-anies-baswedan-agar-menang-di-pilpres-2024/,2023-10-11,True
Jokowi Temui dan Tawarkan Putranya Jadi Cawapres Anies Baswedan,https://turnbackhoax.id/2023/08/23/salah-jokowi-temui-dan-tawarkan-putranya-jadi-cawapres-anies-baswedan/,2023-10-11,True
Video Tim 8 Koalisi Resmi Sepakati Siap Majukan Anies Pilpres 2024,https://turnbackhoax.id/2023/08/23/salah-video-tim-8-koalisi-resmi-sepakati-siap-majukan-anies-pilpres-2024/,2023-10-11,True
"Anies Membawa Produk Sasa, Habis 5 Sehari",https://turnbackhoax.id/2023/08/22/salah-anies-membawa-produk-sasa-habis-5-sehari/,2023-10-11,True
Video MEGAWATI PANIK !! 8 PARTAI RESMIKAN MENANGKAN ANIES 2024,https://turnbackhoax.id/2023/08/22/salah-video-megawati-panik-8-partai-resmikan-menangkan-anies-2024/,2023-10-11,True
DUA PEGAWAI KPK DITANGKAP KARENA TERIMA SUAP DARI ANIES,https://turnbackhoax.id/2023/08/22/salah-dua-pegawai-kpk-ditangkap-karena-terima-suap-dari-anies/,2023-10-11,True
DANA 12 MILIAR UNTUK SYARAT AHY MENJADI CAWAPRES ANIES,https://turnbackhoax.id/2023/08/22/salah-dana-12-miliar-untuk-syarat-ahy-menjadi-cawapres-anies/,2023-10-11,True
"PKS DAN DEMOKRAT KOMPAK TARIK DUKUNGAN, NASIB ANIES DAN NASDEM HANCUR LEBUR",https://turnbackhoax.id/2023/08/22/salah-pks-dan-demokrat-kompak-tarik-dukungan-nasib-anies-dan-nasdem-hancur-lebur/,2023-10-11,True
"Usai Keliling Jakarta, Jutaan Jakmania Tumpahkan Dukungan untuk Anies Baswedan",https://turnbackhoax.id/2023/08/22/salah-usai-keliling-jakarta-jutaan-jakmania-tumpahkan-dukungan-untuk-anies-baswedan/,2023-10-11,True
"Usai Peringatan HUT RI, Ratusan Petinggi Deklarasikan Dukung Anies Baswedan",https://turnbackhoax.id/2023/08/22/salah-usai-peringatan-hut-ri-ratusan-petinggi-deklarasikan-dukung-anies-baswedan/,2023-10-11,True
"Khofifah Pimpin Kampanye, Jutaan Warga Jawa Timur Deklarasi Dukung Anies",https://turnbackhoax.id/2023/08/21/salah-khofifah-pimpin-kampanye-jutaan-warga-jawa-timur-deklarasi-dukung-anies/,2023-10-11,True
“RIBUAN ORANG SAMBUT ANIES BASWEDAN DI BANDUNG”,https://turnbackhoax.id/2023/08/15/salah-ribuan-orang-sambut-anies-baswedan-di-bandung/,2023-10-11,True
"Gelar Deklarasi Akbar, Tommy Soeharto Ajak Seluruh Warga Jateng Dukung Anies Baswedan",https://turnbackhoax.id/2023/08/14/salah-gelar-deklarasi-akbar-tommy-soeharto-ajak-seluruh-warga-jateng-dukung-anies-baswedan/,2023-10-11,True
RHOMA IRAMA AJAK FANS DUKUNG ANIES LEWAT NADA,https://turnbackhoax.id/2023/08/13/salah-rhoma-irama-ajak-fans-dukung-anies-lewat-nada/,2023-10-11,True
“AIRLANGGA PERINTAHKAN DPD GOLKAR SEINDONESIA  DUKUNG ANIES DI PILPRES 2024”,https://turnbackhoax.id/2023/08/11/salah-airlangga-perintahkan-dpd-golkar-seindonesia-dukung-anies-di-pilpres-2024/,2023-10-11,True
Foto Anies Membaca Buku Berjudul “How To Lie”,https://turnbackhoax.id/2023/08/11/salah-foto-anies-membaca-buku-berjudul-how-to-lie/,2023-10-11,True
Gambar Anies Memegang Lem Aibon,https://turnbackhoax.id/2023/08/11/salah-gambar-anies-memegang-lem-aibon/,2023-10-11,True
“RIDWAN KAMIL KERAHKAN SEMUA WARGA JABAR UNTUK MENANGKAN ANIES DI PILPRES 2024”,https://turnbackhoax.id/2023/08/08/salah-ridwan-kamil-kerahkan-semua-warga-jabar-untuk-menangkan-anies-di-pilpres-2024/,2023-10-11,True
Anies Tidak Hafal Pancasila,https://turnbackhoax.id/2023/08/07/salah-anies-tidak-hafal-pancasila/,2023-10-11,True
Foto Anies Meraba Perut Wanita Cantik Yang Sedang Hamil,https://turnbackhoax.id/2023/08/07/salah-foto-anies-meraba-perut-wanita-cantik-yang-sedang-hamil/,2023-10-11,True
ANIES BASWEDAN JADI PRESIDEN AKAN BONGKAR KORUPSI ERA JOKOWI & BATALKAN IBUKOTA BARU,https://turnbackhoax.id/2023/08/07/salahanies-baswedan-jadi-presiden-akan-bongkar-korupsi-era-jokowi-batalkan-ibukota-baru/,2023-10-11,True
“PKS DAN NASDEM SEPAKAT SUSI PUDJIASTUTI JADI PENDAMPING ANIES DI PILPRES 2024”,https://turnbackhoax.id/2023/08/03/salah-pks-dan-nasdem-sepakat-susi-pudjiastuti-jadi-pendamping-anies-di-pilpres-2024/,2023-10-11,True
"Ribuan Warga Jatim Penuhi Gelora Bung Tomo, Jokowi Dukung Anies",https://turnbackhoax.id/2023/07/31/salah-ribuan-warga-jatim-penuhi-gelora-bung-tomo-jokowi-dukung-anies/,2023-10-11,True
"Usai Laga Voli Timnas, Pelatih, Pemain, Hingga Suporter Kibarkan Bendera Anies di Stadion Sentul",https://turnbackhoax.id/2023/07/31/salah-usai-laga-voli-timnas-pelatih-pemain-hingga-suporter-kibarkan-bendera-anies-di-stadion-sentul/,2023-10-11,True
Foto Anies Baswedan Memegang Celana Dalam Wanita,https://turnbackhoax.id/2023/07/31/salah-foto-anies-baswedan-memegang-celana-dalam-wanita-2/,2023-10-11,True
KOMUNITAS SOPIR AMBULANS DAN TIM MEDIS DEKLARASI ANIES 2024,https://turnbackhoax.id/2023/07/30/salah-komunitas-sopir-ambulans-dan-tim-medis-deklarasi-anies-2024/,2023-10-11,True
“TOMY SOEHARTO PIMPIN KAMPANYE ANIES BASWEDAN DI GELORA BUNG KARNO”,https://turnbackhoax.id/2023/07/29/salah-tomy-soeharto-pimpin-kampanye-anies-baswedan-di-gelora-bung-karno/,2023-10-11,True
300 Kabupaten serentak dukung Anies,https://turnbackhoax.id/2023/07/28/salah-300-kabupaten-serentak-dukung-anies/,2023-10-11,True
373 KABUPATEN SERENTAK DEKLARASIKAN ANIES PRESIDEN,https://turnbackhoax.id/2023/07/27/salah-373-kabupaten-serentak-deklarasikan-anies-presiden/,2023-10-11,True
“DOA BERSAMA JUTAAN UMAT DAN PARA SANTRI UNTUK ANIES BASWEDAN JADI PRESIDEN 2024”,https://turnbackhoax.id/2023/07/27/salah-doa-bersama-jutaan-umat-dan-para-santri-untuk-anies-baswedan-jadi-presiden-2024/,2023-10-11,True
Yenny Wahid Ajak Seluruh Anak Yatim Pilih Anies Baswedan di Pilpres 2024,https://turnbackhoax.id/2023/07/27/salah-yenny-wahid-ajak-seluruh-anak-yatim-pilih-anies-baswedan-di-pilpres-2024/,2023-10-11,True
Habib Rizieq Shihab Resmi Dukung Anies Baswedan Jadi Presiden,https://turnbackhoax.id/2023/07/27/salah-habib-rizieq-shihab-resmi-dukung-anies-baswedan-jadi-presiden/,2023-10-11,True
Anies Baswedan Ajak Masyarakat Lakukan Gerakan 1821,https://turnbackhoax.id/2023/07/26/salah-anies-baswedan-ajak-masyarakat-lakukan-gerakan-1821/,2023-10-11,True
JOKOWI TERKEJUT!!GATOT NURMANTYO RESMI CAWAPRES ANIES PILIHAN RAKYAT DI 2024.,https://turnbackhoax.id/2023/07/26/salah-jokowi-terkejutgatot-nurmantyo-resmi-cawapres-anies-pilihan-rakyat-di-2024/,2023-10-11,True
"Di panggil langsung ke istana, Surya Paloh tanda tangan pencapresan Anies resmi di cabut hari ini.",https://turnbackhoax.id/2023/07/26/salah-di-panggil-langsung-ke-istana-surya-paloh-tanda-tangan-pencapresan-anies-resmi-di-cabut-hari-ini/,2023-10-11,True
NASDEM MUNDUR DUKUNG ANIES,https://turnbackhoax.id/2023/07/26/salah-nasdem-mundur-dukung-anies/,2023-10-11,True
PAN DAN DEMOKRAT SIAP MENANGKAN ANIES DI PILPRES 2024,https://turnbackhoax.id/2023/07/26/salah-pan-dan-demokrat-siap-menangkan-anies-di-pilpres-2024/,2023-10-11,True
MEGAWATI MAKIN MERADANG !! JOKOWI RESMI GABUNG TIM KOALISI DEMI MENANGKAN ANIES,https://turnbackhoax.id/2023/07/26/salah-megawati-makin-meradang-jokowi-resmi-gabung-tim-koalisi-demi-menangkan-anies/,2023-10-11,True
“NASDEM LEBIH BAIK KEHILANGAN ANIES BASWEDAN DARI PADA NASDEM SEMAKIN TENGGELAM”,https://turnbackhoax.id/2023/07/25/salah-nasdem-lebih-baik-kehilangan-anies-baswedan-dari-pada-nasdem-semakin-tenggelam/,2023-10-11,True
Video Pendukung Anies di Kalimantan,https://turnbackhoax.id/2023/07/25/salah-video-pendukung-anies-di-kalimantan/,2023-10-11,True
HASIL RAPAT DPR & MPR PUTUSKAN ANIES GANTIKAN JOKOWI DEMI SELAMATKAN BANGSA & NEGARA,https://turnbackhoax.id/2023/07/24/salah-hasil-rapat-dpr-mpr-putuskan-anies-gantikan-jokowi-demi-selamatkan-bangsa-negara/,2023-10-11,True
Gambar Islam Protestan Mempercayai Anies Merupakan Imam Mahdi,https://turnbackhoax.id/2023/07/24/salah-gambar-islam-protestan-mempercayai-anies-merupakan-imam-mahdi/,2023-10-11,True
“Acara Jalan Sehat Anies Baswedan di Jabar dikawal Pasukan Kodam Siliwangi dan Marinir”,https://turnbackhoax.id/2023/07/24/salah-acara-jalan-sehat-anies-baswedan-di-jabar-dikawal-pasukan-kodam-siliwangi-dan-marinir/,2023-10-11,True
Walikota Seluruh Indonesia Sepakat Dukung Anies Baswedan Jadi Presiden 2024,https://turnbackhoax.id/2023/07/23/salah-walikota-seluruh-indonesia-sepakat-dukung-anies-baswedan-jadi-presiden-2024/,2023-10-11,True
Rumah Anies digeruduk The Jack,https://turnbackhoax.id/2023/07/23/salah-rumah-anies-digeruduk-the-jack/,2023-10-11,True
CNN Indonesia: Airlangga Pimpin Paling Depan Mengajak Relawan KIB Maju Menangkan Anies-Khofifah 2024,https://turnbackhoax.id/2023/07/23/salah-cnn-indonesia-airlangga-pimpin-paling-depan-mengajak-relawan-kib-maju-menangkan-anies-khofifah-2024/,2023-10-11,True
Cover Majalah Time : “MENCARI KESALAHAN ANIES SESULIT MENCARI KEJUJURAN JOKOWI”,https://turnbackhoax.id/2023/07/21/salah-cover-majalah-time-mencari-kesalahan-anies-sesulit-mencari-kejujuran-jokowi/,2023-10-11,True
GEMPAR HARI INI ! MEGAWATI RESMI TANDATANGANI PUAN JADI CAWAPRES ANIES 2024,https://turnbackhoax.id/2023/07/18/salah-gempar-hari-ini-megawati-resmi-tandatangani-puan-jadi-cawapres-anies-2024/,2023-10-11,True
"KEPUTUSAN FINAL PARTAI PAN, ZULKIFLI HASAN DAN KADER PAN RESMI DEKLARASIKAN ANIES",https://turnbackhoax.id/2023/07/15/salah-keputusan-final-partai-pan-zulkifli-hasan-dan-kader-pan-resmi-deklarasikan-anies/,2023-10-11,True
"AKIBAT TAK USUNG ANIES, EKS KADER PAN BAKAR ATRIBUT PARTAI",https://turnbackhoax.id/2023/07/15/salah-akibat-tak-usung-anies-eks-kader-pan-bakar-atribut-partai/,2023-10-11,True
“BUKTI SURYA PALOH DAN NASDEM GUNAKAN DANA BTS UNTUK MODAL KAMPAYE ANIES”,https://turnbackhoax.id/2023/07/15/salah-bukti-surya-paloh-dan-nasdem-gunakan-dana-bts-untuk-modal-kampaye-anies/,2023-10-11,True
Anies Membaca Buku “1001 JURUS MENIPU”,https://turnbackhoax.id/2023/07/15/salah-anies-membaca-buku-1001-jurus-menipu/,2023-10-11,True
"Jama’ah Haji Dukung Anies, Ribuan Orang Deklarasi Anies Langsung Depan KA’BAH",https://turnbackhoax.id/2023/07/13/salah-jamaah-haji-dukung-anies-ribuan-orang-deklarasi-anies-langsung-depan-kabah/,2023-10-11,True
Gambar Anies dengan narasi “The King Of Ngibul”,https://turnbackhoax.id/2023/07/11/salah-gambar-anies-dengan-narasi-the-king-of-ngibul/,2023-10-11,True
Pecalang dan Tokoh Besar Bali Kawal Anies Menang 50 Persen,https://turnbackhoax.id/2023/07/11/salah-pecalang-dan-tokoh-besar-bali-kawal-anies-menang-50-persen/,2023-10-11,True
RELAWAN ANIES TERUS BERGERAK DAN KIBARKAN BALIHO RAKSASA MESKI ANIES DI MEKKAH,https://turnbackhoax.id/2023/07/10/salah-relawan-anies-terus-bergerak-dan-kibarkan-baliho-raksasa-meski-anies-di-mekkah/,2023-10-11,True
PAN Resmi Dibubarkan Demi Memenangkan Anies Baswedan,https://turnbackhoax.id/2023/07/10/salah-pan-resmi-dibubarkan-demi-memenangkan-anies-baswedan/,2023-10-11,True
"Pamer Kecanggihan JIS, Presiden FIFA Akui Anies Sosok Pemimpin Masa Depan",https://turnbackhoax.id/2023/07/10/salah-pamer-kecanggihan-jis-presiden-fifa-akui-anies-sosok-pemimpin-masa-depan/,2023-10-11,True
"IKUTI INSTRUKSI JUSUF HAMKA, SELURUH WARGA TIONGHOA DEKLARASI ANIES BASWEDAN",https://turnbackhoax.id/2023/07/04/salah-ikuti-instruksi-jusuf-hamka-seluruh-warga-tionghoa-deklarasi-anies-baswedan/,2023-10-11,True
TNI DAN POLRI SIAP KERAHKAN PASUKAN TANGKAP SIAPA SAJA YG BERANI JEGAL ANIES JADI CAPRES,https://turnbackhoax.id/2023/06/30/salah-tni-dan-polri-siap-kerahkan-pasukan-tangkap-siapa-saja-yg-berani-jegal-anies-jadi-capres/,2023-10-11,True
"Foto “Bagai Presiden, ANIES & RAJA SALMAN dikawal aparat kerajaan saat Tawaf.”",https://turnbackhoax.id/2023/06/28/salah-foto-bagai-presiden-anies-raja-salman-dikawal-aparat-kerajaan-saat-tawaf/,2023-10-11,True
80 PERSEN WARGA JAWA BARAT PILIH ANIES SEBAGAI CALON PRESIDEN 2024 EFEK BESAR DUKUNGAN PUTRI ARIANI,https://turnbackhoax.id/2023/06/28/salah-80-persen-warga-jawa-barat-pilih-anies-sebagai-calon-presiden-2024-efek-besar-dukungan-putri-ariani/,2023-10-11,True
WARGA NAHDLIYIN DAN MUHAMMADIYAH HADIRI KAMPANYE AKBAR ANIES-YENNY DI SURABAYA,https://turnbackhoax.id/2023/06/28/salah-warga-nahdliyin-dan-muhammadiyah-hadiri-kampanye-akbar-anies-yenny-di-surabaya/,2023-10-11,True
"Bukti Korupsi Anies Sudah Di Temukan, KPK Nekat Tes Begini",https://turnbackhoax.id/2023/06/28/salah-bukti-korupsi-anies-sudah-di-temukan-kpk-nekat-tes-begini/,2023-10-11,True
Anies Baswedan Menjadi Tersangka Atas Kasus Korupsi BTS,https://turnbackhoax.id/2023/06/28/salah-anies-baswedan-menjadi-tersangka-atas-kasus-korupsi-bts/,2023-10-11,True
“PSI KECEWA DENGAN PDIP DAN BERBALIK DUKUNG ANIES BASWEDAN DI PILPRES 2024”,https://turnbackhoax.id/2023/06/27/salah-psi-kecewa-dengan-pdip-dan-berbalik-dukung-anies-baswedan-di-pilpres-2024/,2023-10-11,True
“JUSUF HAMKA SUMBANG 100 TRILIUN UNTUK MODAL KAMPANYE ANIES BASWEDAN”,https://turnbackhoax.id/2023/06/27/salah-jusuf-hamka-sumbang-100-triliun-untuk-modal-kampanye-anies-baswedan/,2023-10-11,True
OLIGARKI KEJANG2 !! ISTANA DIAM2 KECOLONGAN || TERNYATA MAHFUD MD DUKUNG ANIES.,https://turnbackhoax.id/2023/06/27/salah-oligarki-kejang2-istana-diam2-kecolongan-ternyata-mahfud-md-dukung-anies/,2023-10-11,True
GEMPAR !! AKHIRNYA MEGAWATI RESMIKAN HARI INI USUNG ANIES MAJU PILPRES 2024.,https://turnbackhoax.id/2023/06/27/salah-gempar-akhirnya-megawati-resmikan-hari-ini-usung-anies-maju-pilpres-2024/,2023-10-11,True
Ada ORBA di Belakang Anies,https://turnbackhoax.id/2023/06/27/salah-ada-orba-di-belakang-anies/,2023-10-11,True
Rakyat Harus Tahu! Misi Jahat Amerika Hancurkan NKRI Lewat Tangan Anies,https://turnbackhoax.id/2023/06/27/salah-rakyat-harus-tahu-misi-jahat-amerika-hancurkan-nkri-lewat-tangan-anies/,2023-10-11,True
RAJA SALMAN DOAKAN ANIES JADI PRESIDEN 2024,https://turnbackhoax.id/2023/06/26/salah-raja-salman-doakan-anies-jadi-presiden-2024/,2023-10-11,True
Baliho Anies Baswedan Terpajang di Masjidil Haram,https://turnbackhoax.id/2023/06/26/salah-baliho-anies-baswedan-terpajang-di-masjidil-haram/,2023-10-11,True
Video Seluruh Warga Jakarta Siap Menangkan Anies Baswedan pada Pemilu 2024,https://turnbackhoax.id/2023/06/26/salah-video-seluruh-warga-jakarta-siap-menangkan-anies-baswedan-pada-pemilu-2024/,2023-10-11,True
Video “NASDEM AKHIRNYA MENYERAH LEBIH BAIK KEHILANGAN ANIES DARI PADA TENGGELAM”,https://turnbackhoax.id/2023/06/25/salah-video-nasdem-akhirnya-menyerah-lebih-baik-kehilangan-anies-dari-pada-tenggelam/,2023-10-11,True
"JAWAB TANTANGAN DARI PDIP, NASDEM DAN PKS DEKLARASI ANIES-JUSUF KALLA",https://turnbackhoax.id/2023/06/23/salah-jawab-tantangan-dari-pdip-nasdem-dan-pks-deklarasi-anies-jusuf-kalla/,2023-10-11,True
Jokowi dan Megawati Akan Dipenjara Akibat Ketahuan Atur KPK dan KPU untuk Jegal Anies Baswedan,https://turnbackhoax.id/2023/06/22/salah-jokowi-dan-megawati-akan-dipenjara-akibat-ketahuan-atur-kpk-dan-kpu-untuk-jegal-anies-baswedan/,2023-10-11,True
Anies Baswedan Resmi Deklarasikan AHY sebagai Cawapres,https://turnbackhoax.id/2023/06/22/salah-anies-baswedan-resmi-deklarasikan-ahy-sebagai-cawapres/,2023-10-11,True
Suami Puan Maharani dan Anies Baswedan Terseret Kasus BTS 4G,https://turnbackhoax.id/2023/06/22/salah-suami-puan-maharani-dan-anies-baswedan-terseret-kasus-bts-4g/,2023-10-11,True
Putri Ariani Mendadak Dukung Anies Baswedan di Hadapan Ribuan Penonton Konser,https://turnbackhoax.id/2023/06/21/salah-putri-ariani-mendadak-dukung-anies-baswedan-di-hadapan-ribuan-penonton-konser/,2023-10-11,True
Seluruh Warga Jombang dan Santri Pesantren Tebu Ireng Dukung Anies – Yenny Wahid di Pemilu 2024,https://turnbackhoax.id/2023/06/21/salah-seluruh-warga-jombang-dan-santri-pesantren-tebu-ireng-dukung-anies-yenny-wahid-di-pemilu-2024/,2023-10-11,True
Anies Beri Solusi Banjir dengan Menunggu Kemarau,https://turnbackhoax.id/2023/06/21/salah-anies-beri-solusi-banjir-dengan-menunggu-kemarau/,2023-10-11,True
ANIES BASWEDAN MUNDUR DARI PENCAPRESAN AKIBAT JAGOANNYA KALAH DI FORMULA E,https://turnbackhoax.id/2023/06/20/salah-anies-baswedan-mundur-dari-pencapresan-akibat-jagoannya-kalah-di-formula-e/,2023-10-11,True
"PUTUSKAN SISTEM PEMILU TERTUTUP, ANIES PERINTAHKAN MAHKAMAH KONSTITUSI DIBUBARKAN",https://turnbackhoax.id/2023/06/20/salah-putuskan-sistem-pemilu-tertutup-anies-perintahkan-mahkamah-konstitusi-dibubarkan/,2023-10-11,True
"“DEMOKRAT KELUAR DARI KOALISI, ANIES DIPASTIKAN GAGAL NYAPRES DI 2024”",https://turnbackhoax.id/2023/06/19/salah-demokrat-keluar-dari-koalisi-anies-dipastikan-gagal-nyapres-di-2024/,2023-10-11,True
"ANIES POSITIF GAGAL NYAPRES, 120.000 KADER NASDEM INDRAMAYU, RAMAI-RAMAI TUNTUT INI",https://turnbackhoax.id/2023/06/19/salah-anies-positif-gagal-nyapres-120-000-kader-nasdem-indramayu-ramai-ramai-tuntut-ini/,2023-10-11,True
"Novel Bamukmin Resmi Jadi Cawapres Anies Baswedan, PKS dan Demorat Tarik Dukungannya",https://turnbackhoax.id/2023/06/19/salah-novel-bamukmin-resmi-jadi-cawapres-anies-baswedan-pks-dan-demorat-tarik-dukungannya/,2023-10-11,True
"Anies Tolak Kedatangan Argentina Ke Indonesia, Erick Thohir Permalukan",https://turnbackhoax.id/2023/06/19/salah-anies-tolak-kedatangan-argentina-ke-indonesia-erick-thohir-permalukan/,2023-10-11,True
Tangkapan Layar Artikel “Anies Baswedan Tegaskan Tak Akan Lanjutkan Semua Program Jokowi Jika Jadi Presiden”,https://turnbackhoax.id/2023/06/19/salah-tangkapan-layar-artikel-anies-baswedan-tegaskan-tak-akan-lanjutkan-semua-program-jokowi-jika-jadi-presiden/,2023-10-11,True
Gambar Majalah Tempo “Sugeng Suparwoto Bohir Anies”,https://turnbackhoax.id/2023/06/16/salah-gambar-majalah-tempo-sugeng-suparwoto-bohir-anies/,2023-10-11,True
Anies Menang Lomba Mewarnai,https://turnbackhoax.id/2023/06/14/salah-anies-menang-lomba-mewarnai/,2023-10-11,True
KEKEUH DUKUNG ANIES !! RATUSAN KADER PAN BAK4R & SEGEL KANTOR DPW,https://turnbackhoax.id/2023/06/13/salah-kekeuh-dukung-anies-ratusan-kader-pan-bak4r-segel-kantor-dpw/,2023-10-11,True
“ANIES BASWEDAN DEKLARASI CAWAPRES TAPI BUKAN AHY”,https://turnbackhoax.id/2023/06/12/salah-anies-baswedan-deklarasi-cawapres-tapi-bukan-ahy/,2023-10-11,True
"“DIRESMIKAN HARI INI, KETUM KOALISI PERUBAHAN SEPAKAT DUET ANIES-KHOFIFAH DI 2024”",https://turnbackhoax.id/2023/06/12/salah-diresmikan-hari-ini-ketum-koalisi-perubahan-sepakat-duet-anies-khofifah-di-2024/,2023-10-11,True
“Anies Baswedan Ajak Masyarakat Tolak Timnas Argentina Bahkan Pemain Pun Dibujuk Tak Datang Latihan!!”,https://turnbackhoax.id/2023/06/12/salah-anies-baswedan-ajak-masyarakat-tolak-timnas-argentina-bahkan-pemain-pun-dibujuk-tak-datang-latihan/,2023-10-11,True
"DIPIMPIN KYAI MA’RUF DAN YENNY WAHID, WARGA NAHDIYIN RESTUI MAHFUD MD JADI CAWAPRES ANIES",https://turnbackhoax.id/2023/06/10/salah-dipimpin-kyai-maruf-dan-yenny-wahid-warga-nahdiyin-restui-mahfud-md-jadi-cawapres-anies/,2023-10-11,True
"“UNGKAP HAL MENGEJUTKAN SOAL PILPRES, JOKOWI BUAT ANIES BASWEDAN  KEPANASAN”",https://turnbackhoax.id/2023/06/08/salah-ungkap-hal-mengejutkan-soal-pilpres-jokowi-buat-anies-baswedan-kepanasan/,2023-10-11,True
“ANIES BASWEDAN  BATAL NYAPRES IMBAS PERUSAHAAN KELUARGA JUSUF KALLA YANG KORUPSI”,https://turnbackhoax.id/2023/06/08/salah-anies-baswedan-batal-nyapres-imbas-perusahaan-keluarga-jusuf-kalla-yang-korupsi/,2023-10-11,True
"Tangkapan Layar Artikel Berjudul “Jalan jalan ke Madiun, Anies Saya ini asli Dawuhan Caruban”",https://turnbackhoax.id/2023/06/06/salah-tangkapan-layar-artikel-berjudul-jalan-jalan-ke-madiun-anies-saya-ini-asli-dawuhan-caruban/,2023-10-11,True
Video “DI SURUH PAK ANIES PEGHINA ISTRI GIBRAN AKUI BEGINI”,https://turnbackhoax.id/2023/06/06/salah-video-di-suruh-pak-anies-peghina-istri-gibran-akui-begini/,2023-10-11,True
"Video “Orang Bayaran Anies Di Tangkap, Tak Terima Istrinya Di Fitnah Gibran Marah Besar”",https://turnbackhoax.id/2023/06/04/salah-video-orang-bayaran-anies-di-tangkap-tak-terima-istrinya-di-fitnah-gibran-marah-besar/,2023-10-11,True
"Video “SELALU TEBAR FITNAH, JOKOWI HAJAR ANIES DAN SBY DENGAN CARA INI”",https://turnbackhoax.id/2023/06/02/salah-video-selalu-tebar-fitnah-jokowi-hajar-anies-dan-sby-dengan-cara-ini/,2023-10-11,True
BALIHO ANIES PRESIDEN TERPAMPANG DI BUS KONVOI TIMNAS,https://turnbackhoax.id/2023/05/31/salah-baliho-anies-presiden-terpampang-di-bus-konvoi-timnas/,2023-10-11,True
Hary Tanoesoedibjo Perintahkan Karyawan MNC TV Dukung Anies di Pemilu 2024,https://turnbackhoax.id/2023/05/30/salah-hary-tanoesoedibjo-perintahkan-karyawan-mnc-tv-dukung-anies-di-pemilu-2024/,2023-10-11,True
PKS dan Demokrat Murka Anies Pilih Pasangan Cawapres Dari Luar Koalisi,https://turnbackhoax.id/2023/05/30/salah-pks-dan-demokrat-murka-anies-pilih-pasangan-cawapres-dari-luar-koalisi/,2023-10-11,True
TINGGALKAN KURSI ISTANA || MA’RUF AMIN MILIH FOKUS DAN MANTAPKAN DUKUNGAN KE ANIES.,https://turnbackhoax.id/2023/05/29/salah-tinggalkan-kursi-istana-maruf-amin-milih-fokus-dan-mantapkan-dukungan-ke-anies/,2023-10-11,True
GEGER SORE INI !! JOKOWI DIBIKIN TR∆GIS || UPAYA UNTUK JEGAL ANIES BERAKIBAT FATAL.,https://turnbackhoax.id/2023/05/29/salah-geger-sore-ini-jokowi-dibikin-tr%e2%88%86gis-upaya-untuk-jegal-anies-berakibat-fatal/,2023-10-11,True
SBY dan Khofifah Pimpin Langsung Deklarasi Dukung Anies Presiden,https://turnbackhoax.id/2023/05/29/salah-sby-dan-khofifah-pimpin-langsung-deklarasi-dukung-anies-presiden/,2023-10-11,True
Demi Maju Dampingi Anies ! Gibran Tunjukkan Surat Pengunduran Diri Dari Walikota,https://turnbackhoax.id/2023/05/27/salah-demi-maju-dampingi-anies-gibran-tunjukkan-surat-pengunduran-diri-dari-walikota/,2023-10-11,True
PAK MAHFUD RESMI DAMPINGI ANIES DI PILPRES 2024 ATAS RESTU JOKOWI,https://turnbackhoax.id/2023/05/27/salah-pak-mahfud-resmi-dampingi-anies-di-pilpres-2024-atas-restu-jokowi/,2023-10-11,True
Video “BREAKING NEWS YOHANIES LANGSUNG DI GARAP KPK JHONNY G PLATE AKUI SEMUA NAMA2 PENIKMAT UANG BTS”,https://turnbackhoax.id/2023/05/27/salah-video-breaking-news-yohanies-langsung-di-garap-kpk-jhonny-g-plate-akui-semua-nama2-penikmat-uang-bts/,2023-10-11,True
Siap Perang Dingin Istana GONJANG-GANJING! Makruf Amin & Seluruh Warga Nu Kawal Anies Pilpres!!,https://turnbackhoax.id/2023/05/27/salah-siap-perang-dingin-istana-gonjang-ganjing-makruf-amin-seluruh-warga-nu-kawal-anies-pilpres/,2023-10-11,True
